P_ID,P_Name,Category,Company_Name,Gender,Price
PD_21002372,Regular Fit Polyester Black Solid Sweater,Sweater,Uniqlo,Women,2510
PD_21002373,Bootcut Stone Wash Indigo Printed Jeans,Jeans,Levi's,Women,1588
PD_21002374,Single-Breasted Poly Blend Gray Houndstooth Blazer,Blazer,Puma,Unisex,1556
PD_21002375,Pullover Nylon Beige Checkered Hoodie,Hoodie,Pantaloons,Women,2217
PD_21002376,Running Cotton Maroon Striped Shorts,Shorts,Gap,Men,2072
PD_21002377,Quilted Polyester White Geometric Jacket,Jacket,H&M,Unisex,1003
PD_21002378,Mini Chiffon Black Colorblock Dress,Dress,Pantaloons,Men,618
PD_21002379,Unstructured Cashmere Gray Checkered Blazer,Blazer,Reebok,Unisex,1618
PD_21002380,Quilted Fleece Brown Printed Jacket,Jacket,Reebok,Unisex,2336
PD_21002381,Relaxed Fit Nylon Olive Green Printed Shorts,Shorts,Nike,Men,1081
PD_21002382,Slim Fit Denim Gray Striped Shirt,Shirt,Zara,Unisex,937
PD_21002383,Formal Polyester White Printed Shirt,Shirt,Uniqlo,Unisex,1969
PD_21002384,Double-Breasted Wool Brown Solid Blazer,Blazer,Levi's,Unisex,1566
PD_21002385,Maxi Polyester Navy Blue Colorblock Dress,Dress,Gap,Men,1397
PD_21002386,Oversized Linen White Floral Shirt,Shirt,Adidas,Unisex,2203
PD_21002387,Slim Fit Wool Navy Blue Houndstooth Blazer,Blazer,H&M,Men,2926
PD_21002388,Maxi Silk Brown Floral Dress,Dress,Zara,Women,2499
PD_21002389,Crew Neck Bamboo Navy Blue Embroidered T-Shirt,T-Shirt,Puma,Women,2566
PD_21002390,Raglan Wool Blend Charcoal Camouflage Hoodie,Hoodie,Pantaloons,Women,2175
PD_21002391,Slim Fit Cotton Gray Houndstooth Blazer,Blazer,Reebok,Women,942
PD_21002392,Oversized Cotton Charcoal Striped Hoodie,Hoodie,Nike,Unisex,885
PD_21002393,Classic Fit Wool Beige Pinstripe Blazer,Blazer,Levi's,Unisex,1217
PD_21002394,Midi Silk Black Textured Skirt,Skirt,Reebok,Women,2050
PD_21002395,Hooded Leather Dark Green Quilted Jacket,Jacket,Levi's,Women,700
PD_21002396,Tapered Denim Gray Distressed Jeans,Jeans,Levi's,Men,2579
PD_21002397,A-Line Velvet Brown Geometric Skirt,Skirt,Pantaloons,Men,777
PD_21002398,Tiered Chiffon Maroon Textured Skirt,Skirt,Reebok,Men,1541
PD_21002399,Classic Fit Linen Brown Herringbone Blazer,Blazer,Nike,Unisex,2427
PD_21002400,Puffer Fleece Beige Embroidered Jacket,Jacket,Adidas,Men,1387
PD_21002401,Double-Breasted Poly Blend Brown Checkered Blazer,Blazer,Levi's,Unisex,795
PD_21002402,Maxi Linen Olive Green Solid Skirt,Skirt,Gap,Men,753
PD_21002403,Bermuda Linen Brown Colorblock Shorts,Shorts,Reebok,Women,630
PD_21002404,Midi Rayon Navy Blue Geometric Skirt,Skirt,Levi's,Men,614
PD_21002405,Peplum Denim Charcoal Colorblock Dress,Dress,Adidas,Men,1077
PD_21002406,Oversized Cashmere White Embroidered Sweater,Sweater,Adidas,Women,1315
PD_21002407,Mini Silk Black Striped Dress,Dress,Adidas,Women,1878
PD_21002408,Raglan Wool Blend Charcoal Checkered Hoodie,Hoodie,Puma,Men,1817
PD_21002409,Chino Linen Black Striped Shorts,Shorts,Levi's,Women,739
PD_21002410,Slim Fit Linen Brown Checkered Blazer,Blazer,Zara,Men,2141
PD_21002411,Unstructured Linen Gray Pinstripe Blazer,Blazer,Reebok,Unisex,917
PD_21002412,Flared Poly-Cotton Olive Green Whiskered Jeans,Jeans,Zara,Women,1967
PD_21002413,Crew Neck Tencel Brown Colorblock T-Shirt,T-Shirt,Puma,Unisex,1476
PD_21002414,Slim Fit Cotton Beige Checkered Blazer,Blazer,Uniqlo,Men,1840
PD_21002415,Sleeveless Acrylic Olive Green Ribbed Hoodie,Hoodie,Zara,Unisex,1204
PD_21002416,Mandarin Collar Cotton Olive Green Colorblock Shirt,Shirt,Levi's,Men,1739
PD_21002417,Tapered Stretch Denim Olive Green Bleached Jeans,Jeans,Reebok,Men,2512
PD_21002418,Flannel Twill Gray Floral Shirt,Shirt,Puma,Men,1838
PD_21002419,Slim Fit Mesh Olive Green Checkered T-Shirt,T-Shirt,Gap,Men,899
PD_21002420,Slim Fit Jersey Navy Blue Solid T-Shirt,T-Shirt,Gap,Unisex,2101
PD_21002421,Peplum Polyester Brown Printed Dress,Dress,Puma,Unisex,1793
PD_21002422,Asymmetrical Cotton Dark Green Textured Skirt,Skirt,Nike,Women,553
PD_21002423,Midi Cotton Olive Green Printed Skirt,Skirt,Puma,Men,2838
PD_21002424,Athletic Acrylic Beige Camouflage Hoodie,Hoodie,Uniqlo,Unisex,860
PD_21002425,Board Linen Gray Solid Shorts,Shorts,H&M,Women,783
PD_21002426,Sleeveless French Terry Navy Blue Ribbed Hoodie,Hoodie,Levi's,Women,760
PD_21002427,Maxi Satin Black Solid Skirt,Skirt,Gap,Unisex,2557
PD_21002428,Oversized Denim Beige Geometric Shirt,Shirt,Zara,Unisex,2759
PD_21002429,Peplum Cotton Maroon Polka Dot Dress,Dress,Adidas,Women,2252
PD_21002430,A-Line Polyester Brown Floral Dress,Dress,H&M,Women,554
PD_21002431,Pullover Fleece Olive Green Striped Sweater,Sweater,Pantaloons,Women,2252
PD_21002432,Slim Fit Raw Denim Washed Blue Bleached Jeans,Jeans,Adidas,Unisex,1988
PD_21002433,Single-Breasted Linen Gray Solid Blazer,Blazer,Levi's,Men,2360
PD_21002434,Cargo Fleece Charcoal Striped Shorts,Shorts,Nike,Men,2879
PD_21002435,Regular Fit Poplin Beige Geometric Shirt,Shirt,Puma,Unisex,2610
PD_21002436,Sleeveless Knit Black Ribbed Hoodie,Hoodie,Puma,Men,1559
PD_21002437,Athletic Rayon Olive Green Ribbed Shorts,Shorts,Zara,Men,1379
PD_21002438,Trench Canvas Navy Blue Geometric Jacket,Jacket,Zara,Women,593
PD_21002439,Pencil Linen Brown Checkered Skirt,Skirt,Puma,Women,1844
PD_21002440,Formal Cotton Brown Solid Shirt,Shirt,Gap,Men,697
PD_21002441,A-Line Linen Charcoal Printed Dress,Dress,Levi's,Women,2359
PD_21002442,Pullover Nylon Olive Green Textured Hoodie,Hoodie,H&M,Unisex,2497
PD_21002443,Mandarin Collar Twill Gray Printed Shirt,Shirt,Reebok,Women,1660
PD_21002444,Polo Jersey Charcoal Ribbed T-Shirt,T-Shirt,Nike,Men,1910
PD_21002445,Pocket Polyester Black Solid T-Shirt,T-Shirt,Reebok,Men,751
PD_21002446,Crew Neck Fleece Navy Blue Checkered Sweater,Sweater,Zara,Men,2166
PD_21002447,Board Nylon Navy Blue Ribbed Shorts,Shorts,H&M,Women,1561
PD_21002448,Henley Rayon Gray Geometric T-Shirt,T-Shirt,Nike,Unisex,1567
PD_21002449,Hooded Fleece Black Geometric Sweater,Sweater,Nike,Women,2792
PD_21002450,Skinny Cotton Blend Dark Blue Bleached Jeans,Jeans,H&M,Women,2341
PD_21002451,Maxi Chiffon Gray Checkered Dress,Dress,Nike,Men,1109
PD_21002452,Denim Twill Gray Solid Shorts,Shorts,Adidas,Men,1030
PD_21002453,Oversized Cotton Navy Geometric Shirt,Shirt,Puma,Women,1027
PD_21002454,Crew Neck Tencel White Printed T-Shirt,T-Shirt,H&M,Women,718
PD_21002455,Empire Waist Velvet Brown Printed Dress,Dress,Puma,Women,1366
PD_21002456,Shift Satin Maroon Embroidered Dress,Dress,Zara,Men,1390
PD_21002457,Mandarin Collar Jersey Charcoal Textured Shirt,Shirt,H&M,Unisex,1355
PD_21002458,Peacoat Leather Charcoal Solid Jacket,Jacket,Nike,Unisex,2473
PD_21002459,Color Block Nylon White Geometric Hoodie,Hoodie,Adidas,Men,2858
PD_21002460,Mandarin Collar Silk Blue Checkered Shirt,Shirt,Levi's,Women,2766
PD_21002461,Polo Modal Gray Checkered T-Shirt,T-Shirt,Gap,Men,2067
PD_21002462,Straight Leg Selvedge Denim Washed Blue Whiskered Jeans,Jeans,Levi's,Unisex,1419
PD_21002463,Trench Cotton Black Striped Jacket,Jacket,Puma,Unisex,2594
PD_21002464,Tapered Denim Olive Green Bleached Jeans,Jeans,Reebok,Men,2480
PD_21002465,Bootcut Raw Denim Indigo Acid Washed Jeans,Jeans,Reebok,Unisex,2560
PD_21002466,Field Denim Maroon Geometric Jacket,Jacket,Levi's,Unisex,1678
PD_21002467,Slim Fit Selvedge Denim Beige Solid Jeans,Jeans,Reebok,Men,647
PD_21002468,Boyfriend Poly-Cotton Olive Green Faded Jeans,Jeans,Levi's,Men,2351
PD_21002469,Oversized Cotton Black Ribbed Hoodie,Hoodie,Gap,Women,2362
PD_21002470,Pleated Rayon Dark Green Solid Shorts,Shorts,Nike,Men,1983
PD_21002471,Classic Fit Linen Brown Pinstripe Blazer,Blazer,Uniqlo,Men,991
PD_21002472,Flannel Jersey Charcoal Textured Shirt,Shirt,Uniqlo,Men,543
PD_21002473,Slim Fit Wool Beige Solid Blazer,Blazer,Reebok,Unisex,882
PD_21002474,Bootcut Acid Wash Gray Whiskered Jeans,Jeans,Levi's,Men,1062
PD_21002475,Pleated Fleece Beige Tie-Dye Shorts,Shorts,Levi's,Men,2428
PD_21002476,Midi Satin Maroon Printed Skirt,Skirt,Uniqlo,Men,2314
PD_21002477,Oversized Knit Dark Green Embroidered Hoodie,Hoodie,Gap,Men,1232
PD_21002478,High-Waisted Stone Wash Black Patchwork Jeans,Jeans,Gap,Women,2509
PD_21002479,High-Waisted Raw Denim Charcoal Distressed Jeans,Jeans,Levi's,Unisex,1409
PD_21002480,Raglan Knit Black Textured Hoodie,Hoodie,Pantaloons,Men,854
PD_21002481,Henley Linen Black Colorblock T-Shirt,T-Shirt,Pantaloons,Women,2042
PD_21002482,Mini Rayon Olive Green Colorblock Skirt,Skirt,Reebok,Men,2421
PD_21002483,Regular Fit Silk Blend Maroon Cable Knit Sweater,Sweater,Gap,Unisex,959
PD_21002484,Quilted Tweed Charcoal Striped Jacket,Jacket,Levi's,Unisex,1839
PD_21002485,Polo Cotton Olive Green Textured T-Shirt,T-Shirt,Reebok,Men,2065
PD_21002486,Bomber Cotton Dark Green Checkered Jacket,Jacket,Zara,Men,2875
PD_21002487,Casual Jersey Olive Green Ribbed Shirt,Shirt,H&M,Women,1329
PD_21002488,Cropped Polyester Dark Green Printed Hoodie,Hoodie,Nike,Men,801
PD_21002489,Flared Rayon Gray Checkered Skirt,Skirt,Nike,Men,2125
PD_21002490,Unstructured Wool Brown Checkered Blazer,Blazer,Pantaloons,Men,1895
PD_21002491,Pencil Satin Dark Green Striped Skirt,Skirt,Uniqlo,Men,2145
PD_21002492,Shift Velvet White Floral Dress,Dress,Zara,Women,2757
PD_21002493,Board Polyester Dark Green Checkered Shorts,Shorts,Reebok,Unisex,2801
PD_21002494,Turtleneck Polyester White Cable Knit Sweater,Sweater,Pantaloons,Unisex,2035
PD_21002495,Flared Linen Dark Green Geometric Skirt,Skirt,Nike,Women,1487
PD_21002496,Crew Neck Wool Black Checkered Sweater,Sweater,Levi's,Men,691
PD_21002497,Fitted Cotton Dark Green Checkered Hoodie,Hoodie,Zara,Unisex,2664
PD_21002498,Turtleneck Alpaca Beige Printed Sweater,Sweater,Pantaloons,Women,2880
PD_21002499,Mini Satin White Textured Skirt,Skirt,Uniqlo,Women,1590
PD_21002500,Henley Silk Navy Colorblock Shirt,Shirt,Reebok,Women,1231
PD_21002501,Pleated Linen Dark Green Geometric Skirt,Skirt,Pantaloons,Women,925
PD_21002502,Regular Fit Polyester Gray Embroidered Shirt,Shirt,H&M,Unisex,1386
PD_21002503,Double-Breasted Cotton Black Houndstooth Blazer,Blazer,Gap,Women,2369
PD_21002504,Henley Polyester Navy Blue Printed T-Shirt,T-Shirt,Levi's,Men,2834
PD_21002505,Single-Breasted Cotton Beige Houndstooth Blazer,Blazer,Gap,Women,2055
PD_21002506,Slim Fit Poly Blend Gray Solid Blazer,Blazer,Adidas,Unisex,1426
PD_21002507,Bodycon Polyester Olive Green Checkered Dress,Dress,Zara,Unisex,2865
PD_21002508,Single-Breasted Cotton Gray Herringbone Blazer,Blazer,Uniqlo,Women,1948
PD_21002509,Slim Fit Polyester Beige Geometric T-Shirt,T-Shirt,Pantaloons,Men,577
PD_21002510,Bodycon Polyester Black Embroidered Dress,Dress,Zara,Unisex,2919
PD_21002511,Leather Fleece Olive Green Embroidered Jacket,Jacket,Nike,Women,1130
PD_21002512,Midi Chiffon White Textured Skirt,Skirt,Zara,Men,2429
PD_21002513,Cargo Twill Beige Embroidered Shorts,Shorts,Pantaloons,Men,2407
PD_21002514,Polo Cotton Navy Blue Striped T-Shirt,T-Shirt,Uniqlo,Men,1259
PD_21002515,Distressed Poly-Cotton Black Acid Washed Jeans,Jeans,Gap,Women,2105
PD_21002516,Polo Denim Blue Striped Shirt,Shirt,Uniqlo,Unisex,2374
PD_21002517,Hooded Polyester Brown Checkered Sweater,Sweater,Uniqlo,Men,2838
PD_21002518,Midi Rayon Black Floral Skirt,Skirt,Pantaloons,Men,2516
PD_21002519,Formal Polyester Black Striped Shirt,Shirt,Puma,Women,1245
PD_21002520,Pullover Silk Blend Grey Textured Sweater,Sweater,Nike,Unisex,2964
PD_21002521,Pencil Linen White Solid Skirt,Skirt,H&M,Unisex,780
PD_21002522,Puffer Denim Gray Striped Jacket,Jacket,H&M,Unisex,2932
PD_21002523,Wrap Satin Beige Colorblock Dress,Dress,H&M,Men,926
PD_21002524,Bomber Fleece Gray Solid Jacket,Jacket,Levi's,Unisex,2440
PD_21002525,Casual Poplin Olive Green Floral Shirt,Shirt,Zara,Women,2938
PD_21002526,Board Linen Gray Geometric Shorts,Shorts,Levi's,Women,1869
PD_21002527,Flared Stone Wash Indigo Solid Jeans,Jeans,Levi's,Unisex,1080
PD_21002528,Wrap Cotton Beige Embroidered Skirt,Skirt,Nike,Women,2055
PD_21002529,Unstructured Poly Blend Black Houndstooth Blazer,Blazer,Adidas,Men,1777
PD_21002530,Slim Fit Cotton Black Herringbone Blazer,Blazer,H&M,Unisex,1928
PD_21002531,Asymmetrical Polyester Olive Green Textured Skirt,Skirt,Puma,Men,1601
PD_21002532,Mini Velvet Olive Green Geometric Dress,Dress,Reebok,Women,2194
PD_21002533,Slim Fit Linen Navy Blue Solid Blazer,Blazer,Nike,Unisex,869
PD_21002534,Straight Leg Stretch Denim Dark Blue Printed Jeans,Jeans,Pantaloons,Men,555
PD_21002535,V-Neck Linen Beige Textured T-Shirt,T-Shirt,Reebok,Unisex,2335
PD_21002536,Color Block Nylon Charcoal Printed Hoodie,Hoodie,Levi's,Women,941
PD_21002537,Single-Breasted Wool Navy Blue Pinstripe Blazer,Blazer,Adidas,Women,2562
PD_21002538,Bodycon Chiffon Beige Checkered Dress,Dress,Uniqlo,Men,2560
PD_21002539,Crew Neck Polyester Brown Checkered T-Shirt,T-Shirt,Zara,Women,961
PD_21002540,Hooded Acrylic Dark Green Printed Sweater,Sweater,Adidas,Women,1863
PD_21002541,Baja Spandex Dark Green Textured Hoodie,Hoodie,Nike,Unisex,927
PD_21002542,Slim Fit Polyester White Checkered Sweater,Sweater,Zara,Women,1904
PD_21002543,Raglan Spandex Maroon Colorblock Hoodie,Hoodie,Puma,Unisex,2820
PD_21002544,Regular Fit Rayon Olive Green Geometric T-Shirt,T-Shirt,Nike,Women,2763
PD_21002545,Shift Chiffon Dark Green Embroidered Dress,Dress,Gap,Men,952
PD_21002546,Athletic Fleece Black Colorblock Hoodie,Hoodie,Zara,Unisex,1470
PD_21002547,Slim Fit Denim Black Solid Jeans,Jeans,Levi's,Women,703
PD_21002548,Pleated Polyester Olive Green Geometric Shorts,Shorts,Zara,Men,1893
PD_21002549,Wrap Chiffon Black Solid Skirt,Skirt,Gap,Women,2856
PD_21002550,A-Line Polyester Beige Embroidered Dress,Dress,Gap,Men,1860
PD_21002551,Henley Denim Blue Printed Shirt,Shirt,Gap,Women,1528
PD_21002552,Mini Rayon White Striped Skirt,Skirt,Reebok,Men,2895
PD_21002553,Denim Denim White Checkered Jacket,Jacket,Pantaloons,Women,2151
PD_21002554,A-Line Linen Olive Green Polka Dot Dress,Dress,Reebok,Men,2418
PD_21002555,Double-Breasted Wool Gray Solid Blazer,Blazer,Reebok,Unisex,2128
PD_21002556,Oversized Silk Gray Embroidered Shirt,Shirt,Gap,Men,1468
PD_21002557,Cargo Nylon Black Solid Shorts,Shorts,Puma,Men,1337
PD_21002558,Wrap Chiffon White Embroidered Skirt,Skirt,Zara,Women,2599
PD_21002559,Zip-Up Wool Blend White Embroidered Hoodie,Hoodie,Levi's,Women,1631
PD_21002560,Mini Velvet Dark Green Embroidered Skirt,Skirt,Uniqlo,Men,1219
PD_21002561,Flared Denim Indigo Bleached Jeans,Jeans,Reebok,Men,547
PD_21002562,Peplum Silk Dark Green Checkered Dress,Dress,Levi's,Women,1353
PD_21002563,Cropped Nylon Maroon Striped Hoodie,Hoodie,Puma,Men,2369
PD_21002564,Formal Linen Maroon Checkered Shirt,Shirt,Adidas,Men,1302
PD_21002565,Asymmetrical Rayon White Floral Skirt,Skirt,Uniqlo,Women,2647
PD_21002566,Distressed Stretch Denim Light Blue Patchwork Jeans,Jeans,Levi's,Women,2143
PD_21002567,Pleated Cotton Beige Checkered Shorts,Shorts,Nike,Women,604
PD_21002568,Chino Polyester Gray Tie-Dye Shorts,Shorts,Puma,Men,510
PD_21002569,Mini Satin Navy Blue Striped Skirt,Skirt,Uniqlo,Women,1401
PD_21002570,Baja Wool Blend Brown Camouflage Hoodie,Hoodie,Pantaloons,Women,1191
PD_21002571,Wrap Linen Black Floral Skirt,Skirt,H&M,Women,2398
PD_21002572,Unstructured Poly Blend Brown Pinstripe Blazer,Blazer,Gap,Unisex,1850
PD_21002573,Flared Cotton Blend Indigo Ripped Jeans,Jeans,Nike,Men,2624
PD_21002574,Denim Canvas Dark Green Colorblock Jacket,Jacket,Nike,Women,2514
PD_21002575,Oversized Polyester Gray Geometric T-Shirt,T-Shirt,H&M,Women,566
PD_21002576,Crew Neck Alpaca Charcoal Geometric Sweater,Sweater,Nike,Unisex,2014
PD_21002577,Trench Cotton Gray Solid Jacket,Jacket,Adidas,Unisex,614
PD_21002578,Bootcut Poly-Cotton Dark Blue Solid Jeans,Jeans,Pantaloons,Women,661
PD_21002579,Unstructured Wool Brown Houndstooth Blazer,Blazer,Pantaloons,Unisex,1907
PD_21002580,Peacoat Polyester Beige Textured Jacket,Jacket,Uniqlo,Women,1975
PD_21002581,Unstructured Cashmere Brown Solid Blazer,Blazer,Puma,Men,2782
PD_21002582,Oversized Acrylic Olive Green Colorblock Hoodie,Hoodie,Reebok,Unisex,2957
PD_21002583,Blazer Polyester Beige Solid Jacket,Jacket,Levi's,Women,688
PD_21002584,Straight Leg Stone Wash Indigo Distressed Jeans,Jeans,Pantaloons,Women,1865
PD_21002585,V-Neck Tencel Maroon Textured T-Shirt,T-Shirt,Zara,Unisex,1806
PD_21002586,Peplum Polyester Beige Polka Dot Dress,Dress,Adidas,Unisex,2344
PD_21002587,Single-Breasted Wool Black Checkered Blazer,Blazer,Uniqlo,Men,1908
PD_21002588,Fitted Polyester Dark Green Ribbed Hoodie,Hoodie,Nike,Unisex,1220
PD_21002589,Straight Leg Stretch Denim Beige Printed Jeans,Jeans,Pantaloons,Men,840
PD_21002590,Baja Acrylic White Printed Hoodie,Hoodie,Puma,Women,693
PD_21002591,Longline Spandex Navy Blue Embroidered T-Shirt,T-Shirt,Zara,Men,2604
PD_21002592,Peplum Linen Maroon Polka Dot Dress,Dress,Pantaloons,Men,1061
PD_21002593,Pleated Cotton Brown Tie-Dye Shorts,Shorts,Puma,Women,1285
PD_21002594,Regular Fit Mesh Charcoal Geometric T-Shirt,T-Shirt,Adidas,Men,2003
PD_21002595,Chino Linen Dark Green Solid Shorts,Shorts,H&M,Unisex,2767
PD_21002596,Slim Fit Stretch Denim Light Blue Faded Jeans,Jeans,Zara,Men,2512
PD_21002597,Mermaid Silk Brown Colorblock Dress,Dress,Adidas,Unisex,1849
PD_21002598,Cropped Nylon Gray Colorblock Hoodie,Hoodie,Pantaloons,Men,1974
PD_21002599,Zipper Cashmere Maroon Checkered Sweater,Sweater,Pantaloons,Unisex,2603
PD_21002600,Midi Tulle Olive Green Printed Skirt,Skirt,Nike,Women,1288
PD_21002601,Pullover Wool Beige Embroidered Sweater,Sweater,Gap,Men,1085
PD_21002602,Slim Fit Knitted Olive Green Printed Sweater,Sweater,Zara,Men,2781
PD_21002603,Chino Twill Olive Green Ribbed Shorts,Shorts,Uniqlo,Unisex,2103
PD_21002604,Field Tweed Olive Green Checkered Jacket,Jacket,Zara,Unisex,2238
PD_21002605,Maxi Satin Gray Printed Skirt,Skirt,Adidas,Men,1820
PD_21002606,Leather Leather Brown Checkered Jacket,Jacket,Gap,Unisex,2925
PD_21002607,Oversized Spandex Beige Printed Hoodie,Hoodie,Adidas,Unisex,2896
PD_21002608,Turtleneck Merino Wool White Embroidered Sweater,Sweater,H&M,Men,2040
PD_21002609,Mini Linen Black Solid Skirt,Skirt,Zara,Unisex,1498
PD_21002610,Zip-Up Polyester Brown Striped Hoodie,Hoodie,Nike,Men,1020
PD_21002611,Classic Fit Cashmere Black Houndstooth Blazer,Blazer,Uniqlo,Women,1785
PD_21002612,Crew Neck Acrylic Grey Ribbed Sweater,Sweater,Adidas,Men,1665
PD_21002613,Distressed Acid Wash Dark Blue Printed Jeans,Jeans,Adidas,Men,1499
PD_21002614,Classic Fit Wool Brown Checkered Blazer,Blazer,Levi's,Men,2940
PD_21002615,Slim Fit Raw Denim Gray Embroidered Jeans,Jeans,Zara,Men,787
PD_21002616,Slim Fit Rayon Beige Solid Shirt,Shirt,H&M,Unisex,2547
PD_21002617,Mandarin Collar Chambray Beige Floral Shirt,Shirt,Pantaloons,Men,1235
PD_21002618,Classic Fit Wool Black Checkered Blazer,Blazer,Uniqlo,Women,2072
PD_21002619,Maxi Denim Navy Blue Floral Dress,Dress,Zara,Women,2923
PD_21002620,Athletic Wool Blend White Checkered Hoodie,Hoodie,Reebok,Women,2269
PD_21002621,A-Line Silk Black Striped Dress,Dress,Puma,Unisex,2616
PD_21002622,Pencil Satin Brown Polka Dot Skirt,Skirt,Pantaloons,Unisex,2924
PD_21002623,Wrap Linen Charcoal Striped Dress,Dress,Puma,Unisex,2881
PD_21002624,Pleated Tulle Gray Solid Skirt,Skirt,H&M,Women,2079
PD_21002625,Longline Mesh White Solid T-Shirt,T-Shirt,Nike,Women,1818
PD_21002626,V-Neck Jersey Navy Blue Embroidered T-Shirt,T-Shirt,Uniqlo,Unisex,2513
PD_21002627,Bodycon Cotton Navy Blue Polka Dot Dress,Dress,Adidas,Unisex,1890
PD_21002628,Longline Linen Dark Green Geometric T-Shirt,T-Shirt,H&M,Men,1107
PD_21002629,Raglan French Terry White Embroidered Hoodie,Hoodie,Adidas,Unisex,924
PD_21002630,Pullover Spandex Black Solid Hoodie,Hoodie,Pantaloons,Women,2013
PD_21002631,Formal Rayon Maroon Colorblock Shirt,Shirt,Gap,Men,2416
PD_21002632,High-Waisted Nylon White Striped Shorts,Shorts,Gap,Unisex,1039
PD_21002633,V-Neck Merino Wool White Colorblock Sweater,Sweater,Levi's,Unisex,2076
PD_21002634,Classic Fit Cashmere Black Herringbone Blazer,Blazer,Nike,Men,2436
PD_21002635,Athletic Twill Dark Green Geometric Shorts,Shorts,Reebok,Unisex,2179
PD_21002636,Oversized Acrylic Beige Colorblock Sweater,Sweater,Zara,Men,2494
PD_21002637,Cropped Knit Black Embroidered Hoodie,Hoodie,Levi's,Unisex,2486
PD_21002638,Cropped Spandex Navy Blue Embroidered Hoodie,Hoodie,Uniqlo,Men,2189
PD_21002639,A-Line Polyester Black Checkered Skirt,Skirt,Adidas,Women,2561
PD_21002640,Regular Fit Polyester White Solid Sweater,Sweater,Puma,Unisex,1449
PD_21002641,Straight Leg Stone Wash Charcoal Whiskered Jeans,Jeans,Levi's,Unisex,1560
PD_21002642,Midi Chiffon Gray Geometric Dress,Dress,Puma,Unisex,882
PD_21002643,Sleeveless Polyester Navy Blue Embroidered Hoodie,Hoodie,Uniqlo,Unisex,1930
PD_21002644,Regular Fit Rayon Olive Green Textured T-Shirt,T-Shirt,Pantaloons,Unisex,1808
PD_21002645,High-Waisted Cotton Blend Beige Ripped Jeans,Jeans,Puma,Men,1803
PD_21002646,Henley Linen Black Colorblock Shirt,Shirt,H&M,Unisex,1544
PD_21002647,Maxi Cotton Brown Polka Dot Skirt,Skirt,H&M,Unisex,2835
PD_21002648,Distressed Rigid Denim White Printed Jeans,Jeans,Gap,Men,2918
PD_21002649,Distressed Acid Wash Gray Acid Washed Jeans,Jeans,Gap,Men,895
PD_21002650,Relaxed Fit Raw Denim Dark Blue Patchwork Jeans,Jeans,Adidas,Men,2300
PD_21002651,Slim Fit Acid Wash White Faded Jeans,Jeans,Pantaloons,Women,2261
PD_21002652,Raglan Cotton Olive Green Geometric Hoodie,Hoodie,Gap,Women,1216
PD_21002653,Peacoat Cotton Dark Green Checkered Jacket,Jacket,Reebok,Men,1390
PD_21002654,Bermuda Mesh Maroon Colorblock Shorts,Shorts,Nike,Women,2196
PD_21002655,Regular Fit Acrylic Grey Embroidered Sweater,Sweater,Nike,Women,2354
PD_21002656,Henley Cotton Charcoal Tie-Dye T-Shirt,T-Shirt,Zara,Women,1777
PD_21002657,Single-Breasted Linen Brown Checkered Blazer,Blazer,Reebok,Women,1953
PD_21002658,Pleated Denim Charcoal Colorblock Shorts,Shorts,Gap,Unisex,617
PD_21002659,Maxi Denim Beige Textured Skirt,Skirt,Puma,Unisex,1492
PD_21002660,High-Waisted Poly-Cotton Indigo Patchwork Jeans,Jeans,Zara,Men,2624
PD_21002661,Midi Tulle Brown Textured Dress,Dress,Pantaloons,Men,2009
PD_21002662,Double-Breasted Poly Blend Navy Blue Houndstooth Blazer,Blazer,Levi's,Women,2478
PD_21002663,Zip-Up Nylon Charcoal Colorblock Hoodie,Hoodie,Adidas,Women,1211
PD_21002664,Shift Silk Dark Green Colorblock Dress,Dress,Reebok,Unisex,989
PD_21002665,Double-Breasted Poly Blend Black Pinstripe Blazer,Blazer,Pantaloons,Women,2261
PD_21002666,Relaxed Fit Mesh Olive Green Striped Shorts,Shorts,Pantaloons,Unisex,1699
PD_21002667,Slim Fit Cotton Black Pinstripe Blazer,Blazer,Adidas,Unisex,748
PD_21002668,Trench Tweed Maroon Ribbed Jacket,Jacket,Reebok,Men,598
PD_21002669,Pleated Polyester Brown Geometric Skirt,Skirt,Puma,Men,2180
PD_21002670,Longline Jersey Gray Colorblock T-Shirt,T-Shirt,Gap,Unisex,1239
PD_21002671,Double-Breasted Wool Black Pinstripe Blazer,Blazer,H&M,Women,1638
PD_21002672,Shift Tulle Maroon Textured Dress,Dress,Puma,Men,605
PD_21002673,A-Line Linen Olive Green Textured Skirt,Skirt,Puma,Men,1720
PD_21002674,Oversized Chambray Blue Floral Shirt,Shirt,Reebok,Men,1772
PD_21002675,Hooded Nylon Olive Green Textured Jacket,Jacket,Reebok,Men,622
PD_21002676,Midi Denim Dark Green Geometric Skirt,Skirt,H&M,Women,951
PD_21002677,Classic Fit Cotton Beige Houndstooth Blazer,Blazer,Levi's,Men,2912
PD_21002678,Maxi Denim Brown Geometric Dress,Dress,H&M,Women,2377
PD_21002679,V-Neck Cotton Beige Cable Knit Sweater,Sweater,H&M,Men,1477
PD_21002680,Boyfriend Acid Wash Light Blue Solid Jeans,Jeans,Nike,Unisex,1716
PD_21002681,Maxi Linen Gray Striped Dress,Dress,Uniqlo,Unisex,920
PD_21002682,Slim Fit Polyester Navy Blue Colorblock Sweater,Sweater,Pantaloons,Unisex,779
PD_21002683,V-Neck Alpaca Black Printed Sweater,Sweater,Levi's,Unisex,2443
PD_21002684,Longline Polyester Charcoal Striped T-Shirt,T-Shirt,Reebok,Women,2446
PD_21002685,High-Waisted Polyester Dark Green Solid Shorts,Shorts,Reebok,Women,2810
PD_21002686,Mandarin Collar Chambray Olive Green Floral Shirt,Shirt,Gap,Men,1365
PD_21002687,Peplum Polyester Navy Blue Embroidered Dress,Dress,Puma,Men,935
PD_21002688,Midi Silk Gray Solid Dress,Dress,Adidas,Men,2378
PD_21002689,Unstructured Wool Beige Houndstooth Blazer,Blazer,Zara,Women,2531
PD_21002690,Color Block Nylon Beige Textured Hoodie,Hoodie,Reebok,Unisex,539
PD_21002691,Boyfriend Stretch Denim Light Blue Printed Jeans,Jeans,Reebok,Men,1476
PD_21002692,Puffer Cotton Gray Ribbed Jacket,Jacket,Pantaloons,Unisex,2127
PD_21002693,Midi Silk Beige Polka Dot Skirt,Skirt,Zara,Women,2291
PD_21002694,Cardigan Cashmere Grey Embroidered Sweater,Sweater,Nike,Women,1663
PD_21002695,Mandarin Collar Poplin Maroon Striped Shirt,Shirt,Levi's,Unisex,855
PD_21002696,Running Cotton Brown Ribbed Shorts,Shorts,Levi's,Women,2252
PD_21002697,Crew Neck Cotton Grey Solid Sweater,Sweater,Puma,Women,1510
PD_21002698,Color Block Nylon Gray Textured Hoodie,Hoodie,Nike,Men,2023
PD_21002699,Asymmetrical Linen Maroon Polka Dot Skirt,Skirt,H&M,Unisex,1425
PD_21002700,Maxi Denim Brown Checkered Skirt,Skirt,Pantaloons,Unisex,2102
PD_21002701,Puffer Cotton Beige Quilted Jacket,Jacket,Uniqlo,Women,2612
PD_21002702,Slim Fit Rigid Denim Dark Blue Solid Jeans,Jeans,Reebok,Women,2228
PD_21002703,Oversized Cashmere White Colorblock Sweater,Sweater,H&M,Women,1147
PD_21002704,Pocket Bamboo Maroon Colorblock T-Shirt,T-Shirt,Gap,Men,1363
PD_21002705,Bermuda Polyester Beige Geometric Shorts,Shorts,Reebok,Women,2206
PD_21002706,Oversized Jersey Olive Green Solid Shirt,Shirt,Puma,Women,2852
PD_21002707,Slim Fit Cashmere Brown Pinstripe Blazer,Blazer,H&M,Women,2615
PD_21002708,Color Block Knit Olive Green Solid Hoodie,Hoodie,Adidas,Women,2117
PD_21002709,Pocket Modal Black Solid T-Shirt,T-Shirt,H&M,Women,2336
PD_21002710,Cargo Mesh Brown Printed Shorts,Shorts,Pantaloons,Unisex,2695
PD_21002711,Pocket Mesh Black Colorblock T-Shirt,T-Shirt,Puma,Women,715
