P_ID,P_Name,Category,Company_Name,Gender,Price
PD_21000001,Distressed Stretch Denim Charcoal Faded Jeans,Jeans,Puma,Unisex,1589
PD_21000002,Straight Leg Cotton Blend Light Blue Faded Jeans,Jeans,Gap,Men,2211
PD_21000003,Single-Breasted Cashmere Gray Houndstooth Blazer,Blazer,Reebok,Unisex,2797
PD_21000004,Cropped Knit Dark Green Textured Hoodie,Hoodie,Puma,Men,2160
PD_21000005,Formal Silk Olive Green Solid Shirt,Shirt,Levi's,Women,566
PD_21000006,Midi Cotton Charcoal Polka Dot Dress,Dress,Puma,Unisex,1480
PD_21000007,Asymmetrical Chiffon Brown Textured Skirt,Skirt,H&M,Men,2793
PD_21000008,Pullover Acrylic Navy Blue Embroidered Hoodie,Hoodie,H&M,Women,1487
PD_21000009,Denim Spandex Beige Colorblock Shorts,Shorts,Puma,Women,1054
PD_21000010,Denim Spandex Brown Checkered Shorts,Shorts,Zara,Men,861
PD_21000011,Pleated Satin Black Geometric Skirt,Skirt,Pantaloons,Men,683
PD_21000012,Graphic Rayon Maroon Tie-Dye T-Shirt,T-Shirt,Levi's,Men,812
PD_21000013,Regular Fit Jersey Olive Green Solid T-Shirt,T-Shirt,H&M,Unisex,752
PD_21000014,Oversized Acrylic Maroon Camouflage Hoodie,Hoodie,Nike,Men,1176
PD_21000015,Formal Jersey Olive Green Solid Shirt,Shirt,Gap,Men,2453
PD_21000016,Single-Breasted Cotton Gray Solid Blazer,Blazer,Nike,Women,2741
PD_21000017,Baja Nylon Black Colorblock Hoodie,Hoodie,Reebok,Men,2965
PD_21000018,Fitted Polyester Brown Camouflage Hoodie,Hoodie,H&M,Women,2935
PD_21000019,Mandarin Collar Silk Charcoal Striped Shirt,Shirt,H&M,Women,966
PD_21000020,Field Polyester Gray Quilted Jacket,Jacket,Zara,Unisex,930
PD_21000021,Raglan Nylon Gray Textured Hoodie,Hoodie,Adidas,Unisex,916
PD_21000022,Pullover Merino Wool Navy Blue Embroidered Sweater,Sweater,Gap,Unisex,1852
PD_21000023,Athletic Spandex White Printed Shorts,Shorts,Zara,Unisex,1622
PD_21000024,Tiered Polyester Maroon Embroidered Skirt,Skirt,Zara,Women,647
PD_21000025,Bomber Tweed White Checkered Jacket,Jacket,Pantaloons,Men,2882
PD_21000026,Formal Denim Beige Embroidered Shirt,Shirt,Reebok,Unisex,1780
PD_21000027,Pullover Cotton Dark Green Solid Sweater,Sweater,Zara,Women,2051
PD_21000028,Relaxed Fit Fleece Maroon Embroidered Shorts,Shorts,Levi's,Women,703
PD_21000029,Classic Fit Poly Blend Brown Houndstooth Blazer,Blazer,Levi's,Women,1003
PD_21000030,Pencil Denim Maroon Floral Skirt,Skirt,Reebok,Men,606
PD_21000031,Flared Tulle Beige Polka Dot Skirt,Skirt,Reebok,Unisex,1362
PD_21000032,Cropped Wool Blend Gray Striped Hoodie,Hoodie,Uniqlo,Women,950
PD_21000033,Cardigan Knitted Maroon Geometric Sweater,Sweater,Gap,Women,919
PD_21000034,Wrap Cotton Olive Green Textured Skirt,Skirt,Uniqlo,Unisex,631
PD_21000035,Wrap Chiffon Beige Checkered Skirt,Skirt,H&M,Men,2654
PD_21000036,Unstructured Poly Blend Gray Solid Blazer,Blazer,Zara,Unisex,2419
PD_21000037,Wrap Silk Maroon Printed Skirt,Skirt,Reebok,Men,2020
PD_21000038,Hooded Cotton Gray Printed Jacket,Jacket,H&M,Men,2533
PD_21000039,Casual Polyester Beige Printed Shirt,Shirt,Zara,Unisex,1221
PD_21000040,Crew Neck Rayon Brown Tie-Dye T-Shirt,T-Shirt,Zara,Unisex,1533
PD_21000041,Crew Neck Polyester Black Ribbed Sweater,Sweater,Levi's,Women,1310
PD_21000042,Flared Rayon Beige Embroidered Skirt,Skirt,H&M,Men,2790
PD_21000043,Mini Chiffon Olive Green Checkered Skirt,Skirt,Gap,Men,1962
PD_21000044,Unstructured Cotton Beige Solid Blazer,Blazer,Gap,Women,2877
PD_21000045,V-Neck Polyester Gray Checkered T-Shirt,T-Shirt,H&M,Men,2051
PD_21000046,Henley Silk Beige Printed Shirt,Shirt,Levi's,Women,540
PD_21000047,Fitted Polyester Black Textured Hoodie,Hoodie,H&M,Unisex,2307
PD_21000048,Flared Cotton Blend Olive Green Embroidered Jeans,Jeans,Zara,Men,1502
PD_21000049,Oxford Jersey Blue Geometric Shirt,Shirt,Levi's,Women,2151
PD_21000050,Baja Cotton Navy Blue Geometric Hoodie,Hoodie,Gap,Men,1441
PD_21000051,Fitted French Terry Charcoal Geometric Hoodie,Hoodie,Levi's,Men,2866
PD_21000052,Classic Fit Cashmere Brown Houndstooth Blazer,Blazer,H&M,Unisex,2402
PD_21000053,Wrap Velvet Charcoal Floral Skirt,Skirt,Levi's,Unisex,1965
PD_21000054,Puffer Suede Charcoal Quilted Jacket,Jacket,H&M,Men,628
PD_21000055,Crew Neck Wool Brown Printed Sweater,Sweater,Nike,Men,727
PD_21000056,Midi Silk Charcoal Geometric Dress,Dress,Puma,Unisex,1151
PD_21000057,Raglan Spandex Navy Blue Ribbed Hoodie,Hoodie,Reebok,Women,1579
PD_21000058,Unstructured Linen Gray Houndstooth Blazer,Blazer,Reebok,Unisex,786
PD_21000059,Slim Fit Cashmere Brown Colorblock Sweater,Sweater,Nike,Women,598
PD_21000060,Flared Stone Wash Dark Blue Distressed Jeans,Jeans,Adidas,Unisex,1215
PD_21000061,Regular Fit Tencel Beige Solid T-Shirt,T-Shirt,Gap,Men,729
PD_21000062,Henley Modal Dark Green Checkered T-Shirt,T-Shirt,H&M,Unisex,1290
PD_21000063,Hooded Suede Charcoal Printed Jacket,Jacket,Adidas,Women,2304
PD_21000064,A-Line Silk White Embroidered Skirt,Skirt,Nike,Men,861
PD_21000065,Trench Tweed Gray Geometric Jacket,Jacket,Adidas,Men,1375
PD_21000066,Mermaid Silk Black Floral Dress,Dress,Adidas,Men,666
PD_21000067,Henley Jersey Maroon Printed Shirt,Shirt,Gap,Unisex,2575
PD_21000068,Color Block Polyester Beige Colorblock Hoodie,Hoodie,Zara,Unisex,796
PD_21000069,Mandarin Collar Rayon Charcoal Striped Shirt,Shirt,Puma,Men,1533
PD_21000070,Regular Fit Chambray Olive Green Striped Shirt,Shirt,Uniqlo,Unisex,2299
PD_21000071,V-Neck Cotton Dark Green Solid Sweater,Sweater,Uniqlo,Unisex,2248
PD_21000072,Cardigan Silk Blend Brown Colorblock Sweater,Sweater,H&M,Men,2070
PD_21000073,Mermaid Denim Gray Printed Dress,Dress,Adidas,Unisex,2428
PD_21000074,Single-Breasted Cotton Navy Blue Checkered Blazer,Blazer,Puma,Unisex,1321
PD_21000075,High-Waisted Fleece Maroon Textured Shorts,Shorts,Nike,Unisex,720
PD_21000076,Pullover Polyester Charcoal Geometric Hoodie,Hoodie,Gap,Women,850
PD_21000077,Flared Denim Olive Green Geometric Skirt,Skirt,Levi's,Unisex,1868
PD_21000078,Graphic Jersey Charcoal Tie-Dye T-Shirt,T-Shirt,Pantaloons,Unisex,1924
PD_21000079,A-Line Satin Maroon Colorblock Skirt,Skirt,Gap,Women,2157
PD_21000080,Maxi Tulle White Floral Dress,Dress,Pantaloons,Women,2884
PD_21000081,Pencil Satin Charcoal Colorblock Skirt,Skirt,Reebok,Unisex,2321
PD_21000082,Pocket Mesh White Textured T-Shirt,T-Shirt,Zara,Men,923
PD_21000083,Henley Spandex Dark Green Solid T-Shirt,T-Shirt,H&M,Men,2281
PD_21000084,Mini Silk Gray Polka Dot Dress,Dress,Reebok,Men,2411
PD_21000085,Maxi Rayon Navy Blue Printed Dress,Dress,Adidas,Men,1488
PD_21000086,High-Waisted Poly-Cotton Indigo Solid Jeans,Jeans,H&M,Women,2117
PD_21000087,Straight Leg Stretch Denim White Bleached Jeans,Jeans,Gap,Men,1229
PD_21000088,Graphic Linen Charcoal Checkered T-Shirt,T-Shirt,Puma,Unisex,2942
PD_21000089,Midi Tulle Maroon Colorblock Skirt,Skirt,Nike,Women,2403
PD_21000090,Unstructured Poly Blend Beige Solid Blazer,Blazer,Zara,Men,2513
PD_21000091,Wrap Polyester Gray Geometric Dress,Dress,H&M,Men,979
PD_21000092,Hooded Suede Charcoal Quilted Jacket,Jacket,Nike,Unisex,2417
PD_21000093,Bomber Canvas Brown Quilted Jacket,Jacket,Levi's,Men,1508
PD_21000094,Midi Chiffon Maroon Textured Skirt,Skirt,H&M,Men,1074
PD_21000095,Midi Velvet Charcoal Solid Dress,Dress,Levi's,Men,533
PD_21000096,Classic Fit Cashmere Navy Blue Checkered Blazer,Blazer,Reebok,Unisex,2426
PD_21000097,Chino Polyester Charcoal Solid Shorts,Shorts,Puma,Women,1868
PD_21000098,Maxi Velvet Navy Blue Geometric Skirt,Skirt,Reebok,Unisex,2534
PD_21000099,Board Cotton Brown Ribbed Shorts,Shorts,Pantaloons,Unisex,1033
PD_21000100,Slim Fit Linen Blue Solid Shirt,Shirt,Gap,Women,724
PD_21000101,Relaxed Fit Spandex Gray Embroidered Shorts,Shorts,Zara,Women,2471
PD_21000102,Wrap Rayon Charcoal Checkered Skirt,Skirt,Puma,Women,1047
PD_21000103,Color Block Spandex Dark Green Solid Hoodie,Hoodie,Zara,Unisex,2460
PD_21000104,Regular Fit Denim Black Ribbed Shirt,Shirt,Levi's,Women,1968
PD_21000105,Henley Twill Gray Geometric Shirt,Shirt,Levi's,Unisex,582
PD_21000106,Longline Bamboo Charcoal Textured T-Shirt,T-Shirt,Levi's,Unisex,2734
PD_21000107,Pleated Chiffon Beige Striped Skirt,Skirt,Puma,Women,1999
PD_21000108,V-Neck Fleece Navy Blue Embroidered Sweater,Sweater,Reebok,Unisex,1981
PD_21000109,Bodycon Chiffon Navy Blue Solid Dress,Dress,Levi's,Women,1415
PD_21000110,Bootcut Raw Denim Gray Distressed Jeans,Jeans,Zara,Unisex,1204
PD_21000111,Denim Tweed Charcoal Striped Jacket,Jacket,Uniqlo,Unisex,1230
PD_21000112,Single-Breasted Linen Navy Blue Herringbone Blazer,Blazer,Zara,Women,2884
PD_21000113,Quilted Leather White Quilted Jacket,Jacket,Uniqlo,Men,538
PD_21000114,Zipper Merino Wool Olive Green Colorblock Sweater,Sweater,Levi's,Men,2148
PD_21000115,Regular Fit Mesh Navy Blue Colorblock T-Shirt,T-Shirt,Adidas,Unisex,1864
PD_21000116,Pleated Silk Beige Embroidered Skirt,Skirt,Reebok,Women,1377
PD_21000117,Pleated Rayon White Checkered Skirt,Skirt,Reebok,Women,1625
PD_21000118,V-Neck Alpaca Charcoal Solid Sweater,Sweater,Zara,Women,1943
PD_21000119,Bermuda Fleece Beige Tie-Dye Shorts,Shorts,H&M,Unisex,2621
PD_21000120,Formal Denim Navy Solid Shirt,Shirt,Puma,Men,2686
PD_21000121,Raglan Wool Blend Brown Embroidered Hoodie,Hoodie,Uniqlo,Men,985
PD_21000122,Slim Fit Jersey Gray Embroidered Shirt,Shirt,Adidas,Unisex,2001
PD_21000123,Relaxed Fit Mesh White Solid Shorts,Shorts,H&M,Women,563
PD_21000124,Polo Modal Navy Blue Printed T-Shirt,T-Shirt,Adidas,Unisex,2200
PD_21000125,Regular Fit Denim Maroon Solid Shirt,Shirt,Adidas,Men,1775
PD_21000126,Casual Linen Navy Ribbed Shirt,Shirt,Puma,Men,2663
PD_21000127,Mini Satin Brown Textured Dress,Dress,Uniqlo,Men,2044
PD_21000128,Double-Breasted Cashmere Brown Herringbone Blazer,Blazer,Puma,Men,582
PD_21000129,Flared Selvedge Denim Dark Blue Distressed Jeans,Jeans,Puma,Unisex,2126
PD_21000130,Pleated Chiffon Black Embroidered Skirt,Skirt,Reebok,Unisex,1785
PD_21000131,Athletic Denim Maroon Embroidered Shorts,Shorts,Nike,Unisex,1165
PD_21000132,Pleated Rayon Navy Blue Printed Shorts,Shorts,Nike,Men,839
PD_21000133,Board Cotton Olive Green Printed Shorts,Shorts,Puma,Unisex,1177
PD_21000134,Distressed Rigid Denim Dark Blue Patchwork Jeans,Jeans,Adidas,Men,2662
PD_21000135,Polo Spandex Olive Green Geometric T-Shirt,T-Shirt,Adidas,Unisex,1328
PD_21000136,Midi Linen Black Checkered Dress,Dress,Levi's,Women,1924
PD_21000137,Shift Chiffon Beige Embroidered Dress,Dress,Zara,Men,758
PD_21000138,Straight Leg Poly-Cotton Charcoal Distressed Jeans,Jeans,Adidas,Women,692
PD_21000139,Polo Bamboo White Checkered T-Shirt,T-Shirt,Pantaloons,Unisex,783
PD_21000140,Single-Breasted Wool Gray Herringbone Blazer,Blazer,Adidas,Unisex,1255
PD_21000141,Bomber Tweed Navy Blue Geometric Jacket,Jacket,Nike,Women,1982
PD_21000142,Flared Polyester Dark Green Colorblock Skirt,Skirt,Gap,Women,725
PD_21000143,Oversized Linen Navy Checkered Shirt,Shirt,Levi's,Men,2474
PD_21000144,Chino Denim Olive Green Embroidered Shorts,Shorts,Levi's,Unisex,1484
PD_21000145,Hooded Polyester Gray Solid Jacket,Jacket,Puma,Women,1489
PD_21000146,Cropped Wool Blend Olive Green Checkered Hoodie,Hoodie,Puma,Men,1944
PD_21000147,Single-Breasted Cotton Navy Blue Herringbone Blazer,Blazer,Pantaloons,Unisex,1293
PD_21000148,Classic Fit Wool Black Houndstooth Blazer,Blazer,Nike,Unisex,1819
PD_21000149,Cardigan Cotton Grey Cable Knit Sweater,Sweater,Reebok,Men,677
PD_21000150,Wrap Rayon Olive Green Geometric Dress,Dress,Nike,Women,2280
PD_21000151,Oxford Chambray Navy Ribbed Shirt,Shirt,Uniqlo,Men,1734
PD_21000152,Double-Breasted Cashmere Black Houndstooth Blazer,Blazer,Reebok,Unisex,2641
PD_21000153,Pencil Satin Dark Green Solid Skirt,Skirt,Uniqlo,Unisex,1107
PD_21000154,Polo Tencel Black Solid T-Shirt,T-Shirt,Nike,Men,1485
PD_21000155,Mini Chiffon Gray Embroidered Dress,Dress,Nike,Unisex,2174
PD_21000156,Tapered Stone Wash Light Blue Acid Washed Jeans,Jeans,Reebok,Women,2104
PD_21000157,Regular Fit Cotton Grey Textured Sweater,Sweater,H&M,Unisex,1792
PD_21000158,Pleated Tulle Maroon Checkered Skirt,Skirt,Uniqlo,Women,666
PD_21000159,Empire Waist Velvet Olive Green Textured Dress,Dress,Levi's,Men,1036
PD_21000160,Pullover Acrylic Dark Green Cable Knit Sweater,Sweater,Puma,Unisex,2038
PD_21000161,Casual Polyester Gray Checkered Shirt,Shirt,Gap,Women,933
PD_21000162,High-Waisted Cotton Blend Dark Blue Patchwork Jeans,Jeans,Uniqlo,Women,2565
PD_21000163,Relaxed Fit Denim Washed Blue Solid Jeans,Jeans,H&M,Men,2970
PD_21000164,Boyfriend Stretch Denim White Bleached Jeans,Jeans,Reebok,Unisex,2164
PD_21000165,Oversized Silk Charcoal Printed Shirt,Shirt,Gap,Unisex,2815
PD_21000166,Flannel Linen Black Printed Shirt,Shirt,Gap,Unisex,2811
PD_21000167,Pocket Tencel Gray Textured T-Shirt,T-Shirt,Reebok,Unisex,1167
PD_21000168,Leather Canvas Black Textured Jacket,Jacket,Adidas,Men,1156
PD_21000169,Mini Chiffon Charcoal Geometric Skirt,Skirt,Gap,Unisex,583
PD_21000170,Zip-Up Fleece Olive Green Printed Hoodie,Hoodie,Puma,Women,573
PD_21000171,Zipper Cashmere White Printed Sweater,Sweater,H&M,Unisex,1809
PD_21000172,Tapered Denim Light Blue Patchwork Jeans,Jeans,Gap,Unisex,2090
PD_21000173,Tiered Silk White Striped Skirt,Skirt,Reebok,Men,2883
PD_21000174,Pleated Linen Gray Embroidered Skirt,Skirt,Adidas,Men,2440
PD_21000175,Flared Rigid Denim Black Embroidered Jeans,Jeans,Zara,Men,890
PD_21000176,Asymmetrical Denim Charcoal Geometric Skirt,Skirt,Gap,Unisex,2718
PD_21000177,Tapered Selvedge Denim Black Patchwork Jeans,Jeans,Zara,Women,2526
PD_21000178,Crew Neck Cotton Olive Green Solid Sweater,Sweater,Reebok,Unisex,2458
PD_21000179,Denim Mesh White Geometric Shorts,Shorts,Levi's,Women,1121
PD_21000180,Regular Fit Knitted Charcoal Checkered Sweater,Sweater,Uniqlo,Women,2959
PD_21000181,Asymmetrical Rayon Beige Embroidered Skirt,Skirt,Puma,Men,547
PD_21000182,Crew Neck Mesh White Tie-Dye T-Shirt,T-Shirt,Zara,Unisex,1159
PD_21000183,High-Waisted Poly-Cotton Gray Distressed Jeans,Jeans,Levi's,Unisex,1538
PD_21000184,Pleated Denim Beige Floral Skirt,Skirt,Reebok,Men,2933
PD_21000185,Baja Jirga Charcoal Solid Hoodie,Hoodie,Levi's,Men,2006
PD_21000186,Cargo Fleece Beige Geometric Shorts,Shorts,Pantaloons,Unisex,1949
PD_21000187,Athletic Denim White Checkered Shorts,Shorts,Nike,Men,698
PD_21000188,Mini Chiffon Beige Colorblock Skirt,Skirt,Pantaloons,Unisex,2570
PD_21000189,Wrap Polyester Black Floral Dress,Dress,Adidas,Women,2306
PD_21000190,Slim Fit Polyester White Textured T-Shirt,T-Shirt,Puma,Unisex,1099
PD_21000191,Baja Cotton Beige Embroidered Hoodie,Hoodie,Pantaloons,Men,571
PD_21000192,Henley Silk Black Colorblock Shirt,Shirt,H&M,Men,671
PD_21000193,Wrap Silk Dark Green Solid Skirt,Skirt,Levi's,Unisex,639
PD_21000194,Slim Fit Rayon Dark Green Embroidered T-Shirt,T-Shirt,Pantaloons,Women,2524
PD_21000195,Bootcut Recycled Denim Black Whiskered Jeans,Jeans,Reebok,Men,1102
PD_21000196,Pullover Polyester Black Colorblock Sweater,Sweater,Uniqlo,Men,1704
PD_21000197,V-Neck Spandex White Ribbed T-Shirt,T-Shirt,Levi's,Unisex,2560
PD_21000198,Henley Silk Charcoal Floral Shirt,Shirt,Levi's,Women,606
PD_21000199,Sleeveless Polyester Beige Colorblock Hoodie,Hoodie,Nike,Men,2291
PD_21000200,Formal Silk Maroon Striped Shirt,Shirt,Pantaloons,Women,2537
PD_21000201,Tiered Polyester Brown Geometric Skirt,Skirt,Levi's,Unisex,524
PD_21000202,Slim Fit Stone Wash White Acid Washed Jeans,Jeans,Zara,Women,1568
PD_21000203,Hooded Fleece Black Printed Jacket,Jacket,Levi's,Men,2172
PD_21000204,Bootcut Cotton Blend Washed Blue Patchwork Jeans,Jeans,Zara,Men,1467
PD_21000205,Skinny Selvedge Denim Washed Blue Acid Washed Jeans,Jeans,Reebok,Unisex,913
PD_21000206,Regular Fit Knitted Charcoal Ribbed Sweater,Sweater,Uniqlo,Unisex,2869
PD_21000207,Maxi Tulle Olive Green Polka Dot Dress,Dress,Levi's,Unisex,1545
PD_21000208,Bomber Nylon Charcoal Printed Jacket,Jacket,Puma,Unisex,1056
PD_21000209,Slim Fit Rayon Charcoal Embroidered T-Shirt,T-Shirt,Nike,Unisex,1376
PD_21000210,Blazer Nylon Brown Geometric Jacket,Jacket,Puma,Women,1809
PD_21000211,Double-Breasted Poly Blend Brown Solid Blazer,Blazer,Gap,Men,1201
PD_21000212,A-Line Satin Brown Textured Dress,Dress,Pantaloons,Men,2593
PD_21000213,Unstructured Wool Black Solid Blazer,Blazer,H&M,Men,1523
PD_21000214,Crew Neck Acrylic Charcoal Printed Sweater,Sweater,Pantaloons,Men,2905
PD_21000215,A-Line Silk Maroon Textured Dress,Dress,Reebok,Unisex,2618
PD_21000216,Straight Leg Acid Wash Beige Embroidered Jeans,Jeans,Gap,Men,1756
PD_21000217,Pleated Satin Charcoal Checkered Skirt,Skirt,Gap,Men,1727
PD_21000218,Chino Mesh Black Solid Shorts,Shorts,Reebok,Unisex,2785
PD_21000219,Quilted Suede Charcoal Colorblock Jacket,Jacket,Reebok,Unisex,710
PD_21000220,Trench Wool Black Solid Jacket,Jacket,Reebok,Women,653
PD_21000221,Raglan French Terry Beige Striped Hoodie,Hoodie,Zara,Men,809
PD_21000222,Slim Fit Linen Beige Solid Blazer,Blazer,Uniqlo,Unisex,2744
PD_21000223,Pencil Polyester Black Printed Skirt,Skirt,Reebok,Unisex,2942
PD_21000224,Asymmetrical Rayon Navy Blue Printed Skirt,Skirt,Puma,Men,2389
PD_21000225,Tiered Tulle Navy Blue Polka Dot Skirt,Skirt,Zara,Women,2658
PD_21000226,Formal Rayon Charcoal Embroidered Shirt,Shirt,Uniqlo,Women,1650
PD_21000227,Cropped Acrylic Charcoal Colorblock Hoodie,Hoodie,Gap,Unisex,2755
PD_21000228,Running Cotton Navy Blue Printed Shorts,Shorts,Reebok,Women,1437
PD_21000229,Mandarin Collar Twill Black Ribbed Shirt,Shirt,Nike,Men,1997
PD_21000230,V-Neck Cashmere Grey Printed Sweater,Sweater,H&M,Unisex,1682
PD_21000231,Crew Neck Cashmere Navy Blue Printed Sweater,Sweater,Gap,Women,2816
PD_21000232,Denim Rayon Beige Printed Shorts,Shorts,Pantaloons,Unisex,883
PD_21000233,Denim Polyester White Striped Shorts,Shorts,Reebok,Women,618
PD_21000234,Polo Rayon Beige Solid Shirt,Shirt,Adidas,Men,2403
PD_21000235,Chino Polyester White Tie-Dye Shorts,Shorts,Zara,Women,1349
PD_21000236,Oversized Cotton Brown Solid Hoodie,Hoodie,Reebok,Unisex,854
PD_21000237,Leather Leather Navy Blue Geometric Jacket,Jacket,Uniqlo,Men,1560
PD_21000238,Maxi Tulle Beige Polka Dot Dress,Dress,Zara,Women,2205
PD_21000239,Slim Fit Tencel Maroon Geometric T-Shirt,T-Shirt,Nike,Men,658
PD_21000240,Athletic Mesh Navy Blue Geometric Shorts,Shorts,Pantaloons,Men,961
PD_21000241,Shift Velvet White Striped Dress,Dress,H&M,Women,591
PD_21000242,High-Waisted Twill Beige Solid Shorts,Shorts,Adidas,Men,2615
PD_21000243,High-Waisted Spandex White Embroidered Shorts,Shorts,Levi's,Unisex,613
PD_21000244,Cropped Jirga Gray Textured Hoodie,Hoodie,Uniqlo,Women,569
PD_21000245,Shift Satin White Textured Dress,Dress,Uniqlo,Unisex,1257
PD_21000246,High-Waisted Raw Denim Black Embroidered Jeans,Jeans,Uniqlo,Unisex,1551
PD_21000247,Wrap Denim Charcoal Solid Skirt,Skirt,Puma,Women,2049
PD_21000248,Bermuda Linen Gray Printed Shorts,Shorts,Pantaloons,Unisex,834
PD_21000249,Straight Leg Cotton Blend Beige Patchwork Jeans,Jeans,Reebok,Men,1366
PD_21000250,Peacoat Canvas Navy Blue Quilted Jacket,Jacket,Pantaloons,Unisex,767
PD_21000251,Relaxed Fit Poly-Cotton Dark Blue Patchwork Jeans,Jeans,Uniqlo,Unisex,1850
PD_21000252,Hooded Cotton Dark Green Colorblock Sweater,Sweater,Uniqlo,Men,1832
PD_21000253,Denim Denim Black Textured Shorts,Shorts,Zara,Women,2215
PD_21000254,Pullover Knitted Dark Green Embroidered Sweater,Sweater,Zara,Unisex,2983
PD_21000255,Asymmetrical Velvet Brown Floral Skirt,Skirt,Zara,Unisex,1380
PD_21000256,Straight Leg Rigid Denim Black Bleached Jeans,Jeans,Pantaloons,Unisex,925
PD_21000257,Unstructured Wool Black Houndstooth Blazer,Blazer,Gap,Unisex,2733
PD_21000258,Classic Fit Linen Black Houndstooth Blazer,Blazer,Gap,Women,1917
PD_21000259,Polo Silk Charcoal Embroidered Shirt,Shirt,Pantaloons,Unisex,2785
PD_21000260,Relaxed Fit Mesh Maroon Ribbed Shorts,Shorts,Gap,Women,1468
PD_21000261,Quilted Fleece Beige Printed Jacket,Jacket,Nike,Women,1139
PD_21000262,High-Waisted Nylon Olive Green Geometric Shorts,Shorts,Gap,Men,874
PD_21000263,Single-Breasted Cotton Brown Herringbone Blazer,Blazer,Zara,Women,2791
PD_21000264,Puffer Tweed Navy Blue Striped Jacket,Jacket,Reebok,Unisex,868
PD_21000265,Zipper Wool Navy Blue Colorblock Sweater,Sweater,Uniqlo,Men,2322
PD_21000266,Relaxed Fit Fleece Beige Ribbed Shorts,Shorts,H&M,Unisex,1292
PD_21000267,Running Denim Charcoal Striped Shorts,Shorts,Levi's,Women,1919
PD_21000268,Slim Fit Selvedge Denim Dark Blue Printed Jeans,Jeans,H&M,Men,2112
PD_21000269,Quilted Denim Dark Green Printed Jacket,Jacket,Levi's,Women,800
PD_21000270,High-Waisted Stone Wash Indigo Embroidered Jeans,Jeans,H&M,Unisex,1008
PD_21000271,Tapered Stretch Denim Dark Blue Bleached Jeans,Jeans,Reebok,Unisex,1872
PD_21000272,Wrap Tulle Charcoal Printed Skirt,Skirt,Nike,Men,888
PD_21000273,Slim Fit Stretch Denim Olive Green Distressed Jeans,Jeans,Gap,Unisex,2848
PD_21000274,Pullover French Terry White Colorblock Hoodie,Hoodie,Uniqlo,Unisex,2622
PD_21000275,Fitted Jirga Black Textured Hoodie,Hoodie,Levi's,Men,2235
PD_21000276,Classic Fit Poly Blend Beige Herringbone Blazer,Blazer,Reebok,Men,1706
PD_21000277,Double-Breasted Poly Blend Brown Pinstripe Blazer,Blazer,Pantaloons,Men,2754
PD_21000278,Bootcut Stone Wash Charcoal Printed Jeans,Jeans,Gap,Unisex,678
PD_21000279,Athletic Nylon White Embroidered Hoodie,Hoodie,Puma,Women,1886
PD_21000280,Zipper Polyester Dark Green Geometric Sweater,Sweater,Zara,Unisex,728
PD_21000281,Tapered Stone Wash Black Printed Jeans,Jeans,Nike,Unisex,2337
PD_21000282,Maxi Silk Olive Green Checkered Dress,Dress,Reebok,Women,1703
PD_21000283,Bodycon Polyester Gray Colorblock Dress,Dress,Zara,Women,1935
PD_21000284,Crew Neck Spandex White Printed T-Shirt,T-Shirt,Pantaloons,Unisex,2409
PD_21000285,Mermaid Linen Brown Polka Dot Dress,Dress,Puma,Women,870
PD_21000286,Color Block Nylon White Solid Hoodie,Hoodie,Levi's,Unisex,2634
PD_21000287,V-Neck Knitted Maroon Ribbed Sweater,Sweater,Reebok,Women,608
PD_21000288,Formal Jersey Brown Striped Shirt,Shirt,Puma,Men,1041
PD_21000289,Field Fleece Charcoal Embroidered Jacket,Jacket,Reebok,Unisex,2926
PD_21000290,Slim Fit Cashmere Beige Herringbone Blazer,Blazer,Adidas,Women,736
PD_21000291,Flared Stretch Denim Washed Blue Whiskered Jeans,Jeans,Gap,Unisex,2421
PD_21000292,A-Line Tulle White Textured Dress,Dress,Reebok,Men,1262
PD_21000293,Maxi Rayon Black Solid Skirt,Skirt,Adidas,Unisex,977
PD_21000294,Fitted Fleece Navy Blue Camouflage Hoodie,Hoodie,Zara,Women,2856
PD_21000295,Leather Cotton Dark Green Solid Jacket,Jacket,Zara,Unisex,858
PD_21000296,Bootcut Denim Dark Blue Ripped Jeans,Jeans,Puma,Unisex,757
PD_21000297,Bermuda Spandex Brown Textured Shorts,Shorts,Adidas,Women,867
PD_21000298,Oxford Linen Olive Green Solid Shirt,Shirt,Zara,Women,2431
PD_21000299,Pullover Wool Blend Beige Geometric Hoodie,Hoodie,Uniqlo,Unisex,2262
PD_21000300,Crew Neck Polyester White Embroidered Sweater,Sweater,Adidas,Men,2564
PD_21000301,Wrap Denim White Floral Dress,Dress,Uniqlo,Unisex,2283
PD_21000302,Quilted Fleece Black Colorblock Jacket,Jacket,Uniqlo,Unisex,1445
PD_21000303,Bermuda Denim Navy Blue Textured Shorts,Shorts,Zara,Women,796
PD_21000304,Quilted Fleece Beige Solid Jacket,Jacket,Adidas,Women,688
PD_21000305,Single-Breasted Cotton Brown Houndstooth Blazer,Blazer,Adidas,Unisex,2480
PD_21000306,Cardigan Knitted Charcoal Printed Sweater,Sweater,Nike,Men,863
PD_21000307,Oversized Wool Navy Blue Embroidered Sweater,Sweater,Pantaloons,Women,665
PD_21000308,Single-Breasted Wool Gray Checkered Blazer,Blazer,Uniqlo,Women,1885
PD_21000309,Flannel Rayon Navy Striped Shirt,Shirt,Pantaloons,Unisex,1123
PD_21000310,Trench Polyester Brown Quilted Jacket,Jacket,Zara,Unisex,1268
PD_21000311,Denim Linen Gray Solid Shorts,Shorts,Uniqlo,Unisex,1711
PD_21000312,A-Line Linen Dark Green Floral Dress,Dress,Uniqlo,Unisex,1258
PD_21000313,Hooded Silk Blend Dark Green Checkered Sweater,Sweater,Reebok,Men,2820
PD_21000314,Double-Breasted Cashmere Navy Blue Herringbone Blazer,Blazer,Reebok,Women,869
PD_21000315,Graphic Jersey Navy Blue Textured T-Shirt,T-Shirt,Levi's,Women,2488
PD_21000316,Maxi Velvet Maroon Embroidered Skirt,Skirt,Pantaloons,Men,2778
PD_21000317,Quilted Polyester Maroon Embroidered Jacket,Jacket,Reebok,Women,2396
PD_21000318,Classic Fit Cotton Black Checkered Blazer,Blazer,Zara,Unisex,1804
PD_21000319,Flannel Rayon Olive Green Embroidered Shirt,Shirt,Zara,Men,1856
PD_21000320,Henley Bamboo Maroon Checkered T-Shirt,T-Shirt,Gap,Unisex,2699
PD_21000321,Single-Breasted Poly Blend Gray Solid Blazer,Blazer,Zara,Unisex,1909
PD_21000322,Relaxed Fit Cotton Blend Charcoal Acid Washed Jeans,Jeans,Reebok,Women,2521
PD_21000323,Wrap Rayon Charcoal Textured Dress,Dress,Uniqlo,Women,711
PD_21000324,Peplum Rayon Charcoal Embroidered Dress,Dress,Gap,Unisex,1822
PD_21000325,Bomber Cotton White Ribbed Jacket,Jacket,Uniqlo,Men,1219
PD_21000326,Pocket Jersey Gray Striped T-Shirt,T-Shirt,Nike,Men,2979
PD_21000327,Trench Cotton Navy Blue Quilted Jacket,Jacket,H&M,Unisex,685
PD_21000328,High-Waisted Cotton Blend Gray Embroidered Jeans,Jeans,Reebok,Unisex,1649
PD_21000329,Field Fleece Black Checkered Jacket,Jacket,Zara,Unisex,2697
PD_21000330,A-Line Satin Maroon Polka Dot Dress,Dress,Uniqlo,Men,1182
PD_21000331,Pleated Twill White Geometric Shorts,Shorts,Uniqlo,Men,1085
PD_21000332,Single-Breasted Linen Black Solid Blazer,Blazer,Gap,Women,2570
PD_21000333,Oversized Knit Beige Camouflage Hoodie,Hoodie,Gap,Men,2584
PD_21000334,Unstructured Wool Brown Solid Blazer,Blazer,Pantaloons,Women,2064
PD_21000335,Wrap Velvet Dark Green Floral Skirt,Skirt,H&M,Unisex,2448
PD_21000336,Asymmetrical Cotton Black Floral Skirt,Skirt,Gap,Men,2557
PD_21000337,A-Line Linen Black Textured Skirt,Skirt,Gap,Unisex,2399
PD_21000338,A-Line Silk Gray Striped Skirt,Skirt,Adidas,Women,1982
PD_21000339,Turtleneck Cashmere Dark Green Solid Sweater,Sweater,Nike,Women,1315
PD_21000340,Oversized Polyester White Ribbed Hoodie,Hoodie,Pantaloons,Unisex,1116
