P_ID,P_Name,Category,Company_Name,Gender,Price
PD_21007466,Boyfriend Stone Wash Dark Blue Acid Washed Jeans,Jeans,Uniqlo,Unisex,2241
PD_21007467,Fitted French Terry Brown Embroidered Hoodie,Hoodie,Adidas,Men,2528
PD_21007468,Leather Polyester White Solid Jacket,Jacket,H&M,Unisex,2035
PD_21007469,Chino Fleece White Geometric Shorts,Shorts,Uniqlo,Unisex,2073
PD_21007470,Oxford Poplin Beige Colorblock Shirt,Shirt,Levi's,Unisex,1652
PD_21007471,Casual Polyester Maroon Printed Shirt,Shirt,Adidas,Men,2047
PD_21007472,Straight Leg Cotton Blend Black Printed Jeans,Jeans,Puma,Women,673
PD_21007473,Chino Cotton Beige Colorblock Shorts,Shorts,Adidas,Men,635
PD_21007474,Zip-Up Spandex Olive Green Colorblock Hoodie,Hoodie,Uniqlo,Women,2199
PD_21007475,Mini Cotton Olive Green Embroidered Skirt,Skirt,Gap,Men,982
PD_21007476,Baja Nylon Navy Blue Solid Hoodie,Hoodie,Zara,Unisex,2521
PD_21007477,Maxi Silk Dark Green Polka Dot Dress,Dress,Adidas,Women,2951
PD_21007478,Casual Cotton Olive Green Textured Blazer,Blazer,Uniqlo,Unisex,2193
PD_21007479,Zip-Up Fleece Beige Checkered Hoodie,Hoodie,Gap,Women,2274
PD_21007480,Regular Fit Jersey Brown Colorblock T-Shirt,T-Shirt,Adidas,Men,2782
PD_21007481,Raglan Fleece Beige Colorblock Hoodie,Hoodie,H&M,Unisex,2693
PD_21007482,High-Waisted Cotton Blend Light Blue Acid Washed Jeans,Jeans,Reebok,Unisex,2915
PD_21007483,Sleeveless Spandex White Printed Hoodie,Hoodie,Puma,Women,2184
PD_21007484,Straight Leg Cotton Blend Gray Whiskered Jeans,Jeans,Zara,Unisex,1346
PD_21007485,Board Denim Navy Blue Ribbed Shorts,Shorts,Zara,Men,2044
PD_21007486,Crew Neck Spandex Dark Green Tie-Dye T-Shirt,T-Shirt,Uniqlo,Unisex,1232
PD_21007487,Oversized Acrylic Olive Green Solid Sweater,Sweater,Reebok,Unisex,2930
PD_21007488,Blazer Fleece Beige Colorblock Jacket,Jacket,Levi's,Women,1465
PD_21007489,Boyfriend Acid Wash Indigo Solid Jeans,Jeans,Uniqlo,Men,1913
PD_21007490,Slim Fit Poly-Cotton White Faded Jeans,Jeans,Pantaloons,Men,2487
PD_21007491,Casual Cotton Charcoal Geometric Blazer,Blazer,Puma,Men,2325
PD_21007492,Longline Tencel Brown Striped T-Shirt,T-Shirt,Nike,Men,1839
PD_21007493,Chino Linen Olive Green Striped Shorts,Shorts,Puma,Women,1715
PD_21007494,Puffer Polyester Black Geometric Jacket,Jacket,Uniqlo,Men,2714
PD_21007495,V-Neck Jersey Navy Blue Printed T-Shirt,T-Shirt,Nike,Unisex,1964
PD_21007496,Mini Tulle Beige Geometric Skirt,Skirt,Zara,Men,2511
PD_21007497,Chino Twill Charcoal Ribbed Shorts,Shorts,H&M,Unisex,2431
PD_21007498,Polo Mesh Brown Embroidered T-Shirt,T-Shirt,H&M,Unisex,968
PD_21007499,Slim Fit Stretch Denim Black Printed Jeans,Jeans,Nike,Unisex,2577
PD_21007500,Henley Cotton Charcoal Geometric Shirt,Shirt,Uniqlo,Women,1955
PD_21007501,Wrap Polyester Beige Embroidered Skirt,Skirt,Reebok,Men,2292
PD_21007502,Tapered Stretch Denim Washed Blue Whiskered Jeans,Jeans,Adidas,Men,649
PD_21007503,Flared Stretch Denim Beige Distressed Jeans,Jeans,Levi's,Men,2427
PD_21007504,Regular Fit Jersey Navy Checkered Shirt,Shirt,Pantaloons,Men,2322
PD_21007505,Peacoat Tweed Brown Striped Jacket,Jacket,Pantaloons,Men,2708
PD_21007506,Bodycon Silk Olive Green Striped Dress,Dress,Uniqlo,Men,1479
PD_21007507,Regular Fit Jersey Charcoal Floral Shirt,Shirt,Zara,Women,2456
PD_21007508,Trench Nylon Navy Blue Checkered Jacket,Jacket,H&M,Unisex,2132
PD_21007509,Bermuda Twill Black Checkered Shorts,Shorts,Gap,Men,975
PD_21007510,Cardigan Merino Wool Charcoal Checkered Sweater,Sweater,Zara,Men,713
PD_21007511,Maxi Linen Olive Green Printed Dress,Dress,Levi's,Women,1482
PD_21007512,Running Rayon Brown Ribbed Shorts,Shorts,Pantaloons,Men,2447
PD_21007513,Wrap Satin Dark Green Checkered Skirt,Skirt,Reebok,Women,1723
PD_21007514,Flared Silk Olive Green Colorblock Skirt,Skirt,Puma,Men,2400
PD_21007515,Formal Jersey Black Textured Shirt,Shirt,Gap,Men,2545
PD_21007516,Leather Cotton Gray Quilted Jacket,Jacket,Pantaloons,Unisex,2127
PD_21007517,Oversized Denim Maroon Printed Shirt,Shirt,Zara,Men,905
PD_21007518,Pleated Silk Maroon Solid Skirt,Skirt,Puma,Unisex,2405
PD_21007519,Empire Waist Silk Charcoal Colorblock Dress,Dress,Gap,Unisex,816
PD_21007520,Bermuda Fleece Dark Green Textured Shorts,Shorts,Pantaloons,Men,2288
PD_21007521,High-Waisted Linen Navy Blue Solid Shorts,Shorts,Gap,Women,610
PD_21007522,Chino Cotton Dark Green Colorblock Shorts,Shorts,Zara,Men,1054
PD_21007523,Relaxed Fit Polyester White Printed Shorts,Shorts,Puma,Unisex,1168
PD_21007524,Tapered Denim Light Blue Solid Jeans,Jeans,Levi's,Women,1592
PD_21007525,Zipper Knitted Olive Green Geometric Sweater,Sweater,Nike,Women,2338
PD_21007526,Relaxed Fit Linen Black Embroidered Shorts,Shorts,Uniqlo,Unisex,2626
PD_21007527,A-Line Denim Olive Green Textured Dress,Dress,Uniqlo,Women,1428
PD_21007528,Flared Denim Light Blue Printed Jeans,Jeans,Pantaloons,Unisex,1566
PD_21007529,Bermuda Denim Olive Green Ribbed Shorts,Shorts,Adidas,Men,1127
PD_21007530,Athletic Rayon Dark Green Textured Shorts,Shorts,Zara,Unisex,575
PD_21007531,Maxi Chiffon Black Floral Dress,Dress,Adidas,Men,1778
PD_21007532,A-Line Linen Beige Polka Dot Skirt,Skirt,Nike,Men,1365
PD_21007533,Hooded Merino Wool Dark Green Embroidered Sweater,Sweater,Adidas,Women,1064
PD_21007534,Mini Polyester White Colorblock Dress,Dress,Puma,Unisex,824
PD_21007535,Casual Twill Gray Solid Shirt,Shirt,Nike,Women,2746
PD_21007536,V-Neck Fleece Grey Printed Sweater,Sweater,Levi's,Unisex,751
PD_21007537,Longline Rayon Charcoal Tie-Dye T-Shirt,T-Shirt,Reebok,Women,1420
PD_21007538,Slim Fit Polyester Black Colorblock Sweater,Sweater,Zara,Unisex,1056
PD_21007539,Casual Silk Maroon Solid Shirt,Shirt,Zara,Women,1400
PD_21007540,Mini Linen Beige Colorblock Dress,Dress,Reebok,Men,1486
PD_21007541,Running Denim Charcoal Checkered Shorts,Shorts,Pantaloons,Women,1157
PD_21007542,Single-Breasted Tweed Charcoal Colorblock Blazer,Blazer,Adidas,Unisex,2377
PD_21007543,High-Waisted Fleece White Tie-Dye Shorts,Shorts,Puma,Unisex,1099
PD_21007544,Trench Fleece Dark Green Textured Jacket,Jacket,Levi's,Women,855
PD_21007545,Slim Fit Recycled Denim Dark Blue Whiskered Jeans,Jeans,Reebok,Unisex,1422
PD_21007546,Casual Wool White Textured Blazer,Blazer,Pantaloons,Unisex,2262
PD_21007547,Peplum Silk Charcoal Embroidered Dress,Dress,H&M,Men,1289
PD_21007548,Mermaid Polyester Navy Blue Polka Dot Dress,Dress,H&M,Unisex,2963
PD_21007549,Boyfriend Raw Denim Black Patchwork Jeans,Jeans,Puma,Men,1573
PD_21007550,Tiered Polyester Gray Striped Skirt,Skirt,Levi's,Women,1856
PD_21007551,Fitted Polyester Gray Colorblock Hoodie,Hoodie,Puma,Men,1788
PD_21007552,Casual Velvet Brown Solid Blazer,Blazer,Adidas,Women,1565
PD_21007553,Bodycon Linen Brown Striped Dress,Dress,Uniqlo,Unisex,1746
PD_21007554,Turtleneck Cotton Brown Colorblock Sweater,Sweater,Adidas,Unisex,2543
PD_21007555,Oversized Linen Dark Green Ribbed T-Shirt,T-Shirt,Puma,Women,941
PD_21007556,Wrap Rayon Gray Geometric Dress,Dress,Gap,Women,1602
PD_21007557,Running Nylon Black Geometric Shorts,Shorts,Pantaloons,Men,2956
PD_21007558,Running Nylon Charcoal Striped Shorts,Shorts,Uniqlo,Women,1752
PD_21007559,Denim Fleece Olive Green Embroidered Jacket,Jacket,Puma,Unisex,1522
PD_21007560,Pocket Mesh White Ribbed T-Shirt,T-Shirt,H&M,Women,2664
PD_21007561,Denim Cotton Olive Green Solid Shorts,Shorts,Levi's,Men,2609
PD_21007562,Slim Fit Rigid Denim Beige Faded Jeans,Jeans,Adidas,Men,1690
PD_21007563,Hooded Polyester Maroon Striped Jacket,Jacket,Adidas,Men,2699
PD_21007564,Regular Fit Modal Charcoal Solid T-Shirt,T-Shirt,Uniqlo,Women,2722
PD_21007565,Color Block Nylon Gray Colorblock Hoodie,Hoodie,Nike,Unisex,2444
PD_21007566,Empire Waist Silk Beige Floral Dress,Dress,Levi's,Men,2486
PD_21007567,Athletic French Terry White Striped Hoodie,Hoodie,Reebok,Men,1359
PD_21007568,Bodycon Linen Dark Green Embroidered Dress,Dress,Zara,Men,854
PD_21007569,Polo Mesh Gray Solid T-Shirt,T-Shirt,Gap,Women,2809
PD_21007570,Henley Linen Olive Green Checkered Shirt,Shirt,Uniqlo,Unisex,1752
PD_21007571,Color Block Knit Olive Green Textured Hoodie,Hoodie,Pantaloons,Women,2706
PD_21007572,Mini Cotton Beige Geometric Skirt,Skirt,Reebok,Unisex,2177
PD_21007573,Polo Denim Charcoal Textured Shirt,Shirt,Uniqlo,Unisex,1314
PD_21007574,Tapered Rigid Denim Dark Blue Solid Jeans,Jeans,Pantaloons,Men,2915
PD_21007575,Blazer Denim Maroon Colorblock Jacket,Jacket,Zara,Unisex,922
PD_21007576,Shift Silk Brown Colorblock Dress,Dress,Levi's,Women,2901
PD_21007577,Pullover Wool Beige Textured Sweater,Sweater,Puma,Women,1077
PD_21007578,Oxford Rayon White Ribbed Shirt,Shirt,Zara,Unisex,1088
PD_21007579,Slim Fit Raw Denim Olive Green Faded Jeans,Jeans,Puma,Men,2787
PD_21007580,Polo Polyester Black Geometric Shirt,Shirt,Pantaloons,Men,2796
PD_21007581,Wrap Rayon Maroon Solid Dress,Dress,Pantaloons,Unisex,2576
PD_21007582,Structured Cotton Olive Green Textured Blazer,Blazer,Uniqlo,Women,1680
PD_21007583,Midi Velvet Beige Floral Skirt,Skirt,Adidas,Men,2422
PD_21007584,High-Waisted Linen Beige Ribbed Shorts,Shorts,Zara,Women,1989
PD_21007585,Athletic Denim Beige Colorblock Shorts,Shorts,Nike,Women,1343
PD_21007586,Raglan Knit Charcoal Camouflage Hoodie,Hoodie,Uniqlo,Men,2015
PD_21007587,Sleeveless Acrylic Maroon Camouflage Hoodie,Hoodie,Levi's,Unisex,2166
PD_21007588,Longline Mesh Olive Green Solid T-Shirt,T-Shirt,Puma,Unisex,572
PD_21007589,Formal Linen Dark Green Checkered Blazer,Blazer,Gap,Women,1150
PD_21007590,Oversized Velvet White Printed Blazer,Blazer,Puma,Women,2676
PD_21007591,Slim Fit Polyester Brown Ribbed Shirt,Shirt,Pantaloons,Unisex,2642
PD_21007592,Relaxed Fit Nylon Navy Blue Checkered Shorts,Shorts,Levi's,Unisex,2511
PD_21007593,Running Cotton White Textured Shorts,Shorts,H&M,Men,1677
PD_21007594,Distressed Recycled Denim Washed Blue Acid Washed Jeans,Jeans,Adidas,Women,688
PD_21007595,Wrap Denim Navy Blue Checkered Dress,Dress,H&M,Women,792
PD_21007596,Bermuda Spandex Olive Green Textured Shorts,Shorts,Uniqlo,Men,519
PD_21007597,Wrap Chiffon Charcoal Textured Skirt,Skirt,Uniqlo,Unisex,2649
PD_21007598,Midi Silk Charcoal Embroidered Dress,Dress,Pantaloons,Women,1690
PD_21007599,Mini Rayon Navy Blue Colorblock Dress,Dress,Adidas,Women,2648
PD_21007600,Flared Rigid Denim Washed Blue Distressed Jeans,Jeans,Adidas,Unisex,1507
PD_21007601,Chino Nylon Maroon Printed Shorts,Shorts,H&M,Unisex,1034
PD_21007602,Double-Breasted Denim Black Checkered Blazer,Blazer,Levi's,Women,1607
PD_21007603,Running Fleece Dark Green Colorblock Shorts,Shorts,Uniqlo,Women,2553
PD_21007604,Pleated Mesh Black Striped Shorts,Shorts,Reebok,Women,2355
PD_21007605,Cardigan Wool White Cable Knit Sweater,Sweater,Gap,Unisex,668
PD_21007606,Classic Fit Denim White Ribbed Blazer,Blazer,Puma,Men,1005
PD_21007607,Denim Suede Navy Blue Solid Jacket,Jacket,Puma,Men,1701
PD_21007608,Oversized Twill Maroon Striped Shirt,Shirt,Nike,Unisex,2156
PD_21007609,Peplum Tulle Black Striped Dress,Dress,Nike,Women,1988
PD_21007610,Pleated Mesh Beige Textured Shorts,Shorts,Reebok,Men,1334
PD_21007611,Wrap Velvet Charcoal Printed Dress,Dress,Reebok,Men,2417
PD_21007612,Running Polyester White Printed Shorts,Shorts,Levi's,Unisex,524
PD_21007613,Board Fleece Black Embroidered Shorts,Shorts,H&M,Men,1967
PD_21007614,Midi Rayon Gray Polka Dot Skirt,Skirt,H&M,Men,1693
PD_21007615,Mermaid Polyester Olive Green Geometric Dress,Dress,Gap,Men,1177
PD_21007616,Trench Tweed Maroon Geometric Jacket,Jacket,Uniqlo,Men,2329
PD_21007617,Fitted Cotton Beige Printed Hoodie,Hoodie,Uniqlo,Women,2116
PD_21007618,Hooded Alpaca Black Embroidered Sweater,Sweater,Levi's,Women,1676
PD_21007619,Straight Leg Rigid Denim Charcoal Faded Jeans,Jeans,Zara,Unisex,523
PD_21007620,Leather Fleece White Quilted Jacket,Jacket,Puma,Unisex,2912
PD_21007621,Crew Neck Cotton Beige Checkered T-Shirt,T-Shirt,Gap,Unisex,2231
PD_21007622,Oversized Knit Brown Solid Hoodie,Hoodie,Pantaloons,Men,1388
PD_21007623,Formal Velvet Dark Green Herringbone Blazer,Blazer,Levi's,Women,1300
PD_21007624,V-Neck Wool White Printed Sweater,Sweater,Nike,Unisex,1016
PD_21007625,Slim Fit Cashmere Grey Cable Knit Sweater,Sweater,Levi's,Unisex,1228
PD_21007626,Skinny Rigid Denim Washed Blue Printed Jeans,Jeans,Gap,Unisex,2550
PD_21007627,Mermaid Denim Navy Blue Polka Dot Dress,Dress,Gap,Unisex,2689
PD_21007628,Slim Fit Merino Wool Brown Textured Sweater,Sweater,H&M,Men,2516
PD_21007629,Henley Chambray Blue Solid Shirt,Shirt,Pantaloons,Women,2522
PD_21007630,Baja Knit White Printed Hoodie,Hoodie,Uniqlo,Women,806
PD_21007631,Quilted Wool Maroon Solid Jacket,Jacket,H&M,Women,2908
PD_21007632,Bomber Polyester Beige Geometric Jacket,Jacket,Uniqlo,Unisex,503
PD_21007633,Flannel Polyester Black Solid Shirt,Shirt,Uniqlo,Women,2150
PD_21007634,Mini Denim Black Colorblock Dress,Dress,H&M,Men,598
PD_21007635,Chino Denim White Solid Shorts,Shorts,Reebok,Unisex,2115
PD_21007636,Structured Rayon Brown Textured Blazer,Blazer,Gap,Men,1426
PD_21007637,Hooded Tweed Beige Printed Jacket,Jacket,Pantaloons,Women,2266
PD_21007638,Formal Cotton Gray Ribbed Shirt,Shirt,Uniqlo,Men,1526
PD_21007639,Boyfriend Raw Denim Charcoal Printed Jeans,Jeans,Levi's,Women,2671
PD_21007640,Flared Polyester Charcoal Solid Skirt,Skirt,Adidas,Women,1974
PD_21007641,Wrap Tulle Beige Polka Dot Dress,Dress,Zara,Unisex,628
PD_21007642,Oversized Denim Blue Geometric Shirt,Shirt,Uniqlo,Women,1159
PD_21007643,Running Denim Dark Green Tie-Dye Shorts,Shorts,Zara,Women,2351
PD_21007644,Denim Fleece Beige Textured Shorts,Shorts,H&M,Unisex,1297
PD_21007645,Formal Polyester Gray Embroidered Shirt,Shirt,H&M,Men,2338
PD_21007646,Regular Fit Silk Blend Charcoal Geometric Sweater,Sweater,H&M,Unisex,1301
PD_21007647,Zipper Silk Blend Dark Green Solid Sweater,Sweater,Adidas,Men,1943
PD_21007648,Cargo Spandex Gray Striped Shorts,Shorts,Pantaloons,Unisex,2255
PD_21007649,A-Line Cotton Gray Polka Dot Dress,Dress,Reebok,Men,1046
PD_21007650,Oxford Twill Olive Green Printed Shirt,Shirt,Nike,Unisex,2018
PD_21007651,Slim Fit Alpaca Grey Geometric Sweater,Sweater,Uniqlo,Women,2296
PD_21007652,Regular Fit Cotton Olive Green Embroidered Sweater,Sweater,Puma,Unisex,1938
PD_21007653,Maxi Tulle Black Geometric Skirt,Skirt,Zara,Men,1414
PD_21007654,Running Polyester White Tie-Dye Shorts,Shorts,Pantaloons,Men,1979
PD_21007655,Raglan Polyester White Striped Hoodie,Hoodie,Nike,Men,750
PD_21007656,Single-Breasted Wool Maroon Printed Blazer,Blazer,Zara,Unisex,2875
PD_21007657,Oversized Wool Maroon Solid Sweater,Sweater,Adidas,Unisex,836
PD_21007658,Formal Rayon Charcoal Ribbed Blazer,Blazer,H&M,Unisex,2033
PD_21007659,Peplum Polyester Black Checkered Dress,Dress,Puma,Women,670
PD_21007660,Distressed Stretch Denim Black Solid Jeans,Jeans,H&M,Men,2263
PD_21007661,Wrap Linen Brown Geometric Dress,Dress,Reebok,Women,568
PD_21007662,Oversized Fleece Beige Checkered Sweater,Sweater,Puma,Men,862
PD_21007663,Bermuda Nylon Olive Green Embroidered Shorts,Shorts,Levi's,Women,2697
PD_21007664,Midi Velvet Brown Floral Dress,Dress,Uniqlo,Men,1470
PD_21007665,Single-Breasted Silk Black Striped Blazer,Blazer,Uniqlo,Unisex,1606
PD_21007666,Hooded Wool Maroon Printed Sweater,Sweater,Puma,Women,1618
PD_21007667,Wrap Chiffon Gray Printed Dress,Dress,Levi's,Men,851
PD_21007668,Trench Polyester Beige Geometric Jacket,Jacket,Reebok,Men,2076
PD_21007669,Casual Twill Olive Green Striped Shirt,Shirt,Pantaloons,Women,999
PD_21007670,Cargo Cotton White Solid Shorts,Shorts,H&M,Women,1239
PD_21007671,Flared Raw Denim Gray Faded Jeans,Jeans,Reebok,Men,875
PD_21007672,Wrap Linen Dark Green Textured Skirt,Skirt,Adidas,Women,2211
PD_21007673,Oversized Spandex Black Textured T-Shirt,T-Shirt,Nike,Men,1170
PD_21007674,Running Polyester Olive Green Colorblock Shorts,Shorts,Puma,Unisex,1240
PD_21007675,Baja Spandex Maroon Camouflage Hoodie,Hoodie,Gap,Unisex,2237
PD_21007676,Henley Mesh Dark Green Embroidered T-Shirt,T-Shirt,Puma,Men,1441
PD_21007677,Raglan Wool Blend Dark Green Geometric Hoodie,Hoodie,Zara,Unisex,1442
PD_21007678,Graphic Jersey Olive Green Checkered T-Shirt,T-Shirt,Pantaloons,Unisex,2371
PD_21007679,A-Line Silk Brown Solid Skirt,Skirt,Levi's,Unisex,1183
PD_21007680,Slim Fit Alpaca Charcoal Printed Sweater,Sweater,Gap,Women,1668
PD_21007681,Peplum Polyester Charcoal Floral Dress,Dress,H&M,Women,2018
PD_21007682,Double-Breasted Denim Brown Ribbed Blazer,Blazer,Pantaloons,Men,2972
PD_21007683,Zip-Up Nylon Brown Striped Hoodie,Hoodie,Zara,Unisex,2695
PD_21007684,Asymmetrical Linen Olive Green Printed Skirt,Skirt,Gap,Men,1111
PD_21007685,Shift Rayon Gray Colorblock Dress,Dress,Puma,Women,2627
PD_21007686,Flared Tulle White Textured Skirt,Skirt,Puma,Men,2258
PD_21007687,Hooded Denim Maroon Quilted Jacket,Jacket,Puma,Men,1548
PD_21007688,Oversized Silk Maroon Solid Shirt,Shirt,Nike,Men,2238
PD_21007689,Slim Fit Cotton Navy Blue Embroidered Blazer,Blazer,Levi's,Unisex,1867
PD_21007690,Bodycon Tulle Olive Green Striped Dress,Dress,Pantaloons,Women,2485
PD_21007691,Chino Polyester Gray Solid Shorts,Shorts,Adidas,Women,2938
PD_21007692,Oversized Denim Navy Textured Shirt,Shirt,Levi's,Men,1853
PD_21007693,Flared Stone Wash Washed Blue Embroidered Jeans,Jeans,Reebok,Men,1667
PD_21007694,High-Waisted Fleece Black Embroidered Shorts,Shorts,Reebok,Women,696
PD_21007695,Pleated Twill Black Textured Shorts,Shorts,H&M,Men,1106
PD_21007696,Slim Fit Rayon Brown Herringbone Blazer,Blazer,H&M,Women,2294
PD_21007697,Polo Jersey Brown Tie-Dye T-Shirt,T-Shirt,H&M,Women,1358
PD_21007698,Single-Breasted Tweed Maroon Striped Blazer,Blazer,Nike,Women,2357
PD_21007699,Oxford Chambray Black Floral Shirt,Shirt,Adidas,Men,907
PD_21007700,Running Linen Black Textured Shorts,Shorts,H&M,Men,1442
PD_21007701,Slim Fit Tencel Black Ribbed T-Shirt,T-Shirt,Reebok,Women,1172
PD_21007702,Oversized Tencel Black Striped T-Shirt,T-Shirt,Uniqlo,Men,2935
PD_21007703,Oxford Denim White Embroidered Shirt,Shirt,Adidas,Unisex,2203
PD_21007704,Double-Breasted Polyester Dark Green Geometric Blazer,Blazer,Reebok,Men,1088
PD_21007705,Relaxed Fit Wool Charcoal Geometric Blazer,Blazer,Nike,Unisex,2297
PD_21007706,Hooded Cotton Brown Checkered Sweater,Sweater,Reebok,Unisex,719
PD_21007707,Formal Jersey Black Striped Shirt,Shirt,Puma,Women,1401
PD_21007708,Sleeveless Wool Blend Navy Blue Camouflage Hoodie,Hoodie,Pantaloons,Men,1430
PD_21007709,Sleeveless Wool Blend Dark Green Embroidered Hoodie,Hoodie,Gap,Women,2498
PD_21007710,Regular Fit Denim Maroon Floral Shirt,Shirt,Zara,Women,2146
PD_21007711,V-Neck Cotton Black Ribbed Sweater,Sweater,Adidas,Men,2485
PD_21007712,Maxi Chiffon Charcoal Colorblock Dress,Dress,Levi's,Unisex,2465
PD_21007713,Color Block Knit Dark Green Embroidered Hoodie,Hoodie,Gap,Women,583
PD_21007714,Slim Fit Cotton Gray Embroidered T-Shirt,T-Shirt,Reebok,Unisex,2616
PD_21007715,Denim Mesh Charcoal Checkered Shorts,Shorts,Levi's,Women,1763
PD_21007716,Henley Cotton Brown Colorblock T-Shirt,T-Shirt,Levi's,Women,1920
PD_21007717,Tapered Raw Denim Gray Whiskered Jeans,Jeans,Levi's,Women,2699
PD_21007718,Relaxed Fit Linen Olive Green Striped Shorts,Shorts,Nike,Women,2978
PD_21007719,Zip-Up Acrylic White Ribbed Hoodie,Hoodie,Reebok,Men,549
PD_21007720,A-Line Silk Dark Green Checkered Dress,Dress,Adidas,Men,2973
PD_21007721,Structured Linen Black Printed Blazer,Blazer,Puma,Women,1819
PD_21007722,Blazer Leather Dark Green Checkered Jacket,Jacket,Reebok,Unisex,2990
PD_21007723,Chino Twill Black Printed Shorts,Shorts,Pantaloons,Unisex,1958
PD_21007724,Cardigan Fleece Brown Striped Sweater,Sweater,H&M,Women,994
PD_21007725,Wrap Tulle Gray Printed Skirt,Skirt,Reebok,Men,2867
PD_21007726,Slim Fit Raw Denim Dark Blue Whiskered Jeans,Jeans,Uniqlo,Women,1446
PD_21007727,Trench Canvas Beige Checkered Jacket,Jacket,Puma,Women,2515
PD_21007728,Pullover French Terry Gray Camouflage Hoodie,Hoodie,H&M,Women,2386
PD_21007729,Pleated Cotton White Textured Skirt,Skirt,H&M,Women,789
PD_21007730,Wrap Chiffon White Floral Dress,Dress,Gap,Unisex,1893
PD_21007731,Flannel Twill Blue Geometric Shirt,Shirt,Levi's,Women,1585
PD_21007732,Polo Polyester Brown Checkered Shirt,Shirt,Zara,Unisex,1334
PD_21007733,Running Nylon Gray Textured Shorts,Shorts,Nike,Unisex,2271
PD_21007734,Oversized Fleece Gray Printed Hoodie,Hoodie,H&M,Women,1061
PD_21007735,Oversized Cashmere Dark Green Checkered Sweater,Sweater,Adidas,Unisex,726
PD_21007736,Empire Waist Silk Dark Green Geometric Dress,Dress,Puma,Men,1323
PD_21007737,Oversized Merino Wool Navy Blue Striped Sweater,Sweater,Pantaloons,Unisex,2644
PD_21007738,Wrap Silk Black Textured Skirt,Skirt,Zara,Women,1891
PD_21007739,Maxi Silk Gray Polka Dot Dress,Dress,Pantaloons,Women,2093
PD_21007740,Classic Fit Velvet White Geometric Blazer,Blazer,Pantaloons,Unisex,1650
PD_21007741,Skinny Stretch Denim White Bleached Jeans,Jeans,Levi's,Men,2257
PD_21007742,Zipper Acrylic Grey Checkered Sweater,Sweater,Levi's,Women,869
PD_21007743,Cargo Rayon Olive Green Colorblock Shorts,Shorts,Nike,Unisex,2687
PD_21007744,Oxford Cotton Blue Geometric Shirt,Shirt,Reebok,Women,653
PD_21007745,Oversized Wool Blend Dark Green Geometric Hoodie,Hoodie,H&M,Unisex,529
PD_21007746,Pencil Cotton Black Polka Dot Skirt,Skirt,Nike,Men,909
PD_21007747,Empire Waist Tulle Gray Geometric Dress,Dress,Pantaloons,Men,1586
PD_21007748,Regular Fit Poplin Brown Checkered Shirt,Shirt,Levi's,Women,2259
PD_21007749,Athletic Twill Navy Blue Checkered Shorts,Shorts,Puma,Men,1775
PD_21007750,Puffer Suede White Ribbed Jacket,Jacket,H&M,Men,2370
PD_21007751,Cropped Nylon Olive Green Printed Hoodie,Hoodie,Uniqlo,Men,2479
PD_21007752,Regular Fit Jersey Brown Striped T-Shirt,T-Shirt,Reebok,Men,703
PD_21007753,High-Waisted Acid Wash Black Patchwork Jeans,Jeans,Zara,Unisex,1805
PD_21007754,Wrap Cotton Maroon Checkered Dress,Dress,Uniqlo,Women,601
PD_21007755,Mermaid Denim Brown Colorblock Dress,Dress,H&M,Women,2062
PD_21007756,Regular Fit Jersey Maroon Striped T-Shirt,T-Shirt,Pantaloons,Unisex,2135
PD_21007757,Henley Chambray Charcoal Colorblock Shirt,Shirt,Levi's,Unisex,782
PD_21007758,Zip-Up Knit Charcoal Checkered Hoodie,Hoodie,Adidas,Men,685
PD_21007759,Skinny Stretch Denim Dark Blue Bleached Jeans,Jeans,Reebok,Men,1250
PD_21007760,V-Neck Modal Beige Ribbed T-Shirt,T-Shirt,Reebok,Men,1584
PD_21007761,Maxi Velvet Navy Blue Printed Dress,Dress,Reebok,Men,1189
PD_21007762,Oversized Acrylic Gray Printed Hoodie,Hoodie,Pantaloons,Men,846
PD_21007763,Cargo Twill Dark Green Checkered Shorts,Shorts,Reebok,Women,1956
PD_21007764,Field Leather Beige Embroidered Jacket,Jacket,Uniqlo,Men,1958
PD_21007765,Double-Breasted Cashmere Gray Herringbone Blazer,Blazer,Reebok,Women,2256
PD_21007766,Bodycon Tulle Olive Green Floral Dress,Dress,H&M,Men,903
PD_21007767,Athletic French Terry White Checkered Hoodie,Hoodie,Zara,Unisex,1293
PD_21007768,Oversized Linen Dark Green Textured T-Shirt,T-Shirt,Puma,Men,2333
PD_21007769,Oxford Linen Olive Green Colorblock Shirt,Shirt,Adidas,Women,1818
PD_21007770,Peplum Chiffon Olive Green Geometric Dress,Dress,Zara,Women,1261
PD_21007771,Wrap Cotton White Polka Dot Dress,Dress,Adidas,Women,1413
PD_21007772,Polo Silk Gray Colorblock Shirt,Shirt,Reebok,Unisex,2629
PD_21007773,Maxi Chiffon Navy Blue Striped Dress,Dress,H&M,Men,1644
PD_21007774,Oxford Linen Gray Colorblock Shirt,Shirt,Nike,Unisex,1251
PD_21007775,Regular Fit Polyester Gray Solid Shirt,Shirt,Puma,Men,1300
PD_21007776,Relaxed Fit Polyester Dark Green Ribbed Shorts,Shorts,Pantaloons,Unisex,1218
PD_21007777,Hooded Tweed Beige Quilted Jacket,Jacket,Pantaloons,Women,1692
PD_21007778,Crew Neck Linen Black Striped T-Shirt,T-Shirt,Reebok,Men,1493
PD_21007779,Wrap Polyester Navy Blue Checkered Dress,Dress,Pantaloons,Women,2619
PD_21007780,Midi Linen Maroon Printed Dress,Dress,Nike,Unisex,2986
PD_21007781,Pleated Polyester Olive Green Textured Skirt,Skirt,H&M,Men,1300
PD_21007782,Color Block Spandex Charcoal Embroidered Hoodie,Hoodie,Adidas,Men,2057
PD_21007783,Peplum Cotton Charcoal Polka Dot Dress,Dress,H&M,Unisex,1096
PD_21007784,Hooded Wool Charcoal Checkered Jacket,Jacket,Nike,Women,1918
PD_21007785,Henley Cotton Brown Striped T-Shirt,T-Shirt,Zara,Unisex,1483
PD_21007786,Bodycon Silk Brown Printed Dress,Dress,Reebok,Unisex,2670
PD_21007787,Wrap Denim White Striped Dress,Dress,Uniqlo,Men,1829
PD_21007788,Hooded Alpaca Dark Green Striped Sweater,Sweater,Levi's,Men,544
PD_21007789,Peplum Rayon Navy Blue Textured Dress,Dress,Adidas,Unisex,716
PD_21007790,Regular Fit Cotton Navy Ribbed Shirt,Shirt,Adidas,Unisex,2088
PD_21007791,Classic Fit Rayon Beige Printed Blazer,Blazer,H&M,Unisex,1844
PD_21007792,Slim Fit Rayon Dark Green Printed T-Shirt,T-Shirt,Uniqlo,Unisex,2166
PD_21007793,Oversized Silk Black Printed Shirt,Shirt,Zara,Unisex,1324
PD_21007794,Blazer Nylon Olive Green Checkered Jacket,Jacket,H&M,Unisex,2748
PD_21007795,Crew Neck Silk Blend White Printed Sweater,Sweater,Nike,Men,2283
PD_21007796,Casual Jersey Olive Green Colorblock Shirt,Shirt,Puma,Women,2866
PD_21007797,Sleeveless Polyester Dark Green Ribbed Hoodie,Hoodie,Nike,Women,1940
PD_21007798,Pleated Denim Olive Green Polka Dot Skirt,Skirt,Uniqlo,Men,509
PD_21007799,High-Waisted Fleece Beige Ribbed Shorts,Shorts,Zara,Men,1905
PD_21007800,Board Spandex Maroon Ribbed Shorts,Shorts,Puma,Men,730
PD_21007801,Oversized Fleece Dark Green Checkered Sweater,Sweater,Gap,Men,2461
PD_21007802,Blazer Wool Dark Green Ribbed Jacket,Jacket,Puma,Unisex,766
PD_21007803,Single-Breasted Cashmere Gray Colorblock Blazer,Blazer,Pantaloons,Unisex,1593
PD_21007804,Pleated Rayon White Solid Shorts,Shorts,Pantaloons,Women,1305
PD_21007805,Board Nylon Olive Green Striped Shorts,Shorts,Reebok,Men,2355
PD_21007806,Tapered Acid Wash White Embroidered Jeans,Jeans,Zara,Women,1736
PD_21007807,Slim Fit Rigid Denim Charcoal Solid Jeans,Jeans,Reebok,Women,2461
