P_ID,P_Name,Category,Company_Name,Gender,Price
PD_21004743,Mini Silk Black Floral Dress,Dress,Puma,Unisex,1734
PD_21004744,Running Denim Beige Textured Shorts,Shorts,Pantaloons,Women,2065
PD_21004745,Puffer Cotton White Striped Jacket,Jacket,H&M,Unisex,1907
PD_21004746,Turtleneck Fleece Brown Printed Sweater,Sweater,Reebok,Women,2187
PD_21004747,Slim Fit Cotton Blue Printed Shirt,Shirt,Gap,Men,2970
PD_21004748,Athletic Spandex Black Printed Hoodie,Hoodie,Adidas,Men,1939
PD_21004749,Unstructured Cashmere Navy Blue Solid Blazer,Blazer,Puma,Women,2397
PD_21004750,Straight Leg Poly-Cotton Washed Blue Acid Washed Jeans,Jeans,Levi's,Women,2113
PD_21004751,Slim Fit Jersey Navy Blue Textured T-Shirt,T-Shirt,Levi's,Women,2491
PD_21004752,Oversized Polyester White Solid Shirt,Shirt,H&M,Men,945
PD_21004753,Wrap Tulle Dark Green Polka Dot Skirt,Skirt,Uniqlo,Unisex,2324
PD_21004754,Shift Linen Gray Solid Dress,Dress,Reebok,Men,2492
PD_21004755,Oversized Silk Black Floral Shirt,Shirt,Uniqlo,Unisex,1231
PD_21004756,Double-Breasted Poly Blend Beige Checkered Blazer,Blazer,Uniqlo,Unisex,1478
PD_21004757,Bomber Canvas Gray Colorblock Jacket,Jacket,Nike,Women,770
PD_21004758,Baja Wool Blend Charcoal Ribbed Hoodie,Hoodie,Nike,Men,2168
PD_21004759,Graphic Bamboo Dark Green Striped T-Shirt,T-Shirt,Puma,Unisex,1827
PD_21004760,Classic Fit Linen Gray Solid Blazer,Blazer,Adidas,Men,863
PD_21004761,Midi Denim Dark Green Embroidered Dress,Dress,Zara,Men,2433
PD_21004762,Casual Jersey Gray Checkered Shirt,Shirt,Puma,Women,2379
PD_21004763,Single-Breasted Poly Blend Brown Pinstripe Blazer,Blazer,Adidas,Women,1546
PD_21004764,Formal Polyester Brown Ribbed Shirt,Shirt,Puma,Unisex,1225
PD_21004765,Maxi Polyester Brown Solid Skirt,Skirt,Gap,Men,1009
PD_21004766,Flared Satin White Colorblock Skirt,Skirt,Adidas,Unisex,1357
PD_21004767,Regular Fit Merino Wool Maroon Textured Sweater,Sweater,Pantaloons,Men,2348
PD_21004768,Double-Breasted Poly Blend Navy Blue Checkered Blazer,Blazer,Zara,Unisex,1922
PD_21004769,Oxford Rayon Maroon Ribbed Shirt,Shirt,Adidas,Women,2474
PD_21004770,Relaxed Fit Selvedge Denim Olive Green Whiskered Jeans,Jeans,Levi's,Women,2972
PD_21004771,Wrap Tulle Beige Embroidered Dress,Dress,Puma,Women,2213
PD_21004772,Slim Fit Wool Brown Houndstooth Blazer,Blazer,Adidas,Women,1501
PD_21004773,Slim Fit Poly-Cotton Dark Blue Printed Jeans,Jeans,Adidas,Men,2494
PD_21004774,Bodycon Denim Charcoal Floral Dress,Dress,H&M,Unisex,2853
PD_21004775,V-Neck Polyester Charcoal Colorblock Sweater,Sweater,Zara,Women,1885
PD_21004776,Raglan Nylon Brown Printed Hoodie,Hoodie,Uniqlo,Unisex,971
PD_21004777,Bootcut Stretch Denim Light Blue Faded Jeans,Jeans,Reebok,Women,1978
PD_21004778,Leather Wool Beige Embroidered Jacket,Jacket,Reebok,Men,1193
PD_21004779,Boyfriend Denim Dark Blue Faded Jeans,Jeans,Adidas,Unisex,1582
PD_21004780,Classic Fit Cotton Black Pinstripe Blazer,Blazer,Uniqlo,Women,2823
PD_21004781,Shift Linen Brown Printed Dress,Dress,Reebok,Men,1532
PD_21004782,Quilted Tweed Black Solid Jacket,Jacket,Reebok,Men,1042
PD_21004783,Slim Fit Cashmere Grey Solid Sweater,Sweater,Zara,Men,1191
PD_21004784,Flared Denim Indigo Faded Jeans,Jeans,Gap,Unisex,1010
PD_21004785,Henley Modal Maroon Textured T-Shirt,T-Shirt,Pantaloons,Unisex,924
PD_21004786,Single-Breasted Linen Black Checkered Blazer,Blazer,Nike,Men,2342
PD_21004787,Wrap Polyester Charcoal Striped Skirt,Skirt,Adidas,Men,1831
PD_21004788,Sleeveless Knit Charcoal Solid Hoodie,Hoodie,Gap,Women,1055
PD_21004789,Fitted Acrylic Black Colorblock Hoodie,Hoodie,Gap,Unisex,1917
PD_21004790,Field Tweed Dark Green Textured Jacket,Jacket,H&M,Women,2963
PD_21004791,Wrap Linen Olive Green Colorblock Dress,Dress,Pantaloons,Men,838
PD_21004792,Wrap Silk Navy Blue Colorblock Dress,Dress,Nike,Unisex,1322
PD_21004793,Bermuda Mesh Gray Solid Shorts,Shorts,Reebok,Men,2668
PD_21004794,Pullover Spandex White Printed Hoodie,Hoodie,Reebok,Women,689
PD_21004795,Running Polyester Brown Printed Shorts,Shorts,Nike,Women,2740
PD_21004796,Straight Leg Denim Dark Blue Printed Jeans,Jeans,Pantaloons,Men,566
PD_21004797,Midi Linen White Polka Dot Dress,Dress,Pantaloons,Men,1126
PD_21004798,Running Rayon Beige Checkered Shorts,Shorts,Puma,Men,1936
PD_21004799,Asymmetrical Linen Dark Green Striped Skirt,Skirt,Levi's,Men,2612
PD_21004800,A-Line Polyester Black Embroidered Dress,Dress,Adidas,Unisex,2457
PD_21004801,Slim Fit Acrylic Dark Green Solid Sweater,Sweater,Reebok,Women,1090
PD_21004802,Flared Recycled Denim Olive Green Whiskered Jeans,Jeans,Nike,Men,2563
PD_21004803,Unstructured Cotton Navy Blue Checkered Blazer,Blazer,Reebok,Men,2600
PD_21004804,V-Neck Spandex Maroon Striped T-Shirt,T-Shirt,Adidas,Men,1969
PD_21004805,Single-Breasted Poly Blend Beige Pinstripe Blazer,Blazer,Levi's,Unisex,654
PD_21004806,Quilted Cotton Dark Green Ribbed Jacket,Jacket,Pantaloons,Unisex,1359
PD_21004807,Wrap Denim Dark Green Colorblock Skirt,Skirt,Nike,Men,871
PD_21004808,Trench Denim Navy Blue Checkered Jacket,Jacket,Zara,Unisex,1158
PD_21004809,Regular Fit Silk Blend Black Ribbed Sweater,Sweater,Zara,Women,1732
PD_21004810,Flannel Cotton Maroon Solid Shirt,Shirt,Levi's,Unisex,625
PD_21004811,Flared Polyester Gray Textured Skirt,Skirt,Pantaloons,Unisex,2084
PD_21004812,Empire Waist Rayon Brown Solid Dress,Dress,Uniqlo,Unisex,1387
PD_21004813,Empire Waist Chiffon Dark Green Checkered Dress,Dress,Pantaloons,Women,581
PD_21004814,Pullover Jirga Navy Blue Colorblock Hoodie,Hoodie,Puma,Women,936
PD_21004815,Hooded Cotton Olive Green Geometric Sweater,Sweater,Reebok,Men,2568
PD_21004816,Wrap Rayon Black Checkered Skirt,Skirt,Levi's,Men,2422
PD_21004817,Board Mesh Navy Blue Tie-Dye Shorts,Shorts,Reebok,Unisex,2064
PD_21004818,Cropped Knit Beige Textured Hoodie,Hoodie,Puma,Unisex,2007
PD_21004819,Crew Neck Mesh Gray Textured T-Shirt,T-Shirt,Reebok,Women,1464
PD_21004820,Mermaid Cotton Charcoal Geometric Dress,Dress,H&M,Men,2765
PD_21004821,High-Waisted Recycled Denim Dark Blue Ripped Jeans,Jeans,Puma,Men,507
PD_21004822,Wrap Polyester Navy Blue Polka Dot Dress,Dress,Reebok,Women,705
PD_21004823,Double-Breasted Linen Gray Solid Blazer,Blazer,Pantaloons,Unisex,2752
PD_21004824,Distressed Stretch Denim Charcoal Bleached Jeans,Jeans,Zara,Men,1272
PD_21004825,Flannel Silk White Striped Shirt,Shirt,Gap,Women,1006
PD_21004826,Distressed Selvedge Denim White Distressed Jeans,Jeans,Gap,Women,1137
PD_21004827,Single-Breasted Linen Beige Solid Blazer,Blazer,Reebok,Unisex,1382
PD_21004828,Midi Silk Brown Solid Dress,Dress,Zara,Unisex,2041
PD_21004829,V-Neck Linen Maroon Colorblock T-Shirt,T-Shirt,Reebok,Men,1768
PD_21004830,Slim Fit Fleece Olive Green Embroidered Sweater,Sweater,Uniqlo,Women,1753
PD_21004831,Crew Neck Wool Navy Blue Solid Sweater,Sweater,Puma,Women,2718
PD_21004832,Athletic Wool Blend Charcoal Colorblock Hoodie,Hoodie,Puma,Unisex,1037
PD_21004833,Fitted Nylon Gray Colorblock Hoodie,Hoodie,Reebok,Unisex,1566
PD_21004834,Graphic Cotton White Tie-Dye T-Shirt,T-Shirt,Uniqlo,Men,2745
PD_21004835,Slim Fit Poly Blend Brown Herringbone Blazer,Blazer,Reebok,Unisex,2029
PD_21004836,Bootcut Rigid Denim Dark Blue Embroidered Jeans,Jeans,Reebok,Men,1675
PD_21004837,Shift Chiffon Navy Blue Floral Dress,Dress,Pantaloons,Unisex,2313
PD_21004838,Bomber Suede Charcoal Colorblock Jacket,Jacket,H&M,Women,2378
PD_21004839,Pencil Denim Gray Solid Skirt,Skirt,Zara,Unisex,937
PD_21004840,Flannel Polyester Maroon Floral Shirt,Shirt,Nike,Women,2710
PD_21004841,Flannel Cotton Blue Printed Shirt,Shirt,H&M,Women,2141
PD_21004842,Oversized Poplin White Geometric Shirt,Shirt,Adidas,Men,1367
PD_21004843,Puffer Nylon Charcoal Solid Jacket,Jacket,Adidas,Men,2536
PD_21004844,Henley Chambray Blue Geometric Shirt,Shirt,Levi's,Women,1386
PD_21004845,Pencil Denim White Printed Skirt,Skirt,H&M,Women,2488
PD_21004846,High-Waisted Denim Washed Blue Acid Washed Jeans,Jeans,Uniqlo,Women,2820
PD_21004847,Classic Fit Cotton Black Houndstooth Blazer,Blazer,Zara,Unisex,1362
PD_21004848,Slim Fit Jersey Beige Textured T-Shirt,T-Shirt,Uniqlo,Unisex,1763
PD_21004849,Cardigan Silk Blend Black Geometric Sweater,Sweater,Pantaloons,Unisex,758
PD_21004850,Cropped Cotton Navy Blue Solid Hoodie,Hoodie,Gap,Men,2329
PD_21004851,Mini Chiffon Gray Checkered Skirt,Skirt,Uniqlo,Women,2277
PD_21004852,Slim Fit Merino Wool Olive Green Textured Sweater,Sweater,Puma,Men,1940
PD_21004853,Wrap Chiffon Beige Embroidered Skirt,Skirt,Reebok,Women,1897
PD_21004854,Bermuda Nylon White Solid Shorts,Shorts,Nike,Men,1452
PD_21004855,Polo Polyester Black Colorblock Shirt,Shirt,Adidas,Men,2734
PD_21004856,Regular Fit Cashmere Brown Ribbed Sweater,Sweater,Pantaloons,Unisex,2563
PD_21004857,Polo Rayon Blue Printed Shirt,Shirt,Zara,Men,1376
PD_21004858,Zip-Up Knit Olive Green Checkered Hoodie,Hoodie,H&M,Men,2365
PD_21004859,Wrap Satin Maroon Checkered Dress,Dress,Pantaloons,Unisex,1195
PD_21004860,Peacoat Wool Beige Printed Jacket,Jacket,Nike,Unisex,931
PD_21004861,A-Line Polyester White Striped Skirt,Skirt,Nike,Unisex,1354
PD_21004862,Flared Denim Gray Solid Jeans,Jeans,H&M,Unisex,2543
PD_21004863,Pleated Fleece Dark Green Checkered Shorts,Shorts,Zara,Women,1638
PD_21004864,Flared Silk Gray Striped Skirt,Skirt,Reebok,Unisex,526
PD_21004865,Casual Linen Blue Floral Shirt,Shirt,Nike,Men,909
PD_21004866,Classic Fit Wool Brown Houndstooth Blazer,Blazer,Zara,Women,2235
PD_21004867,Hooded Tweed Black Solid Jacket,Jacket,H&M,Unisex,1320
PD_21004868,Wrap Satin Dark Green Geometric Dress,Dress,Reebok,Men,924
PD_21004869,Casual Twill Navy Embroidered Shirt,Shirt,Puma,Unisex,2829
PD_21004870,Zip-Up French Terry Charcoal Geometric Hoodie,Hoodie,Pantaloons,Women,2705
PD_21004871,Board Twill White Ribbed Shorts,Shorts,Adidas,Women,2008
PD_21004872,Denim Tweed Navy Blue Quilted Jacket,Jacket,Pantaloons,Men,738
PD_21004873,Slim Fit Linen Dark Green Solid T-Shirt,T-Shirt,Pantaloons,Women,1135
PD_21004874,Longline Rayon Dark Green Tie-Dye T-Shirt,T-Shirt,Adidas,Unisex,2382
PD_21004875,Flared Tulle Maroon Embroidered Skirt,Skirt,Gap,Women,814
PD_21004876,Single-Breasted Poly Blend Navy Blue Herringbone Blazer,Blazer,Levi's,Men,600
PD_21004877,Midi Polyester Olive Green Floral Dress,Dress,Uniqlo,Men,2605
PD_21004878,Graphic Mesh Maroon Checkered T-Shirt,T-Shirt,Adidas,Unisex,1674
PD_21004879,Mini Linen Gray Checkered Skirt,Skirt,H&M,Women,1996
PD_21004880,Bodycon Rayon Brown Colorblock Dress,Dress,Levi's,Women,695
PD_21004881,Maxi Satin Beige Embroidered Skirt,Skirt,Reebok,Men,1629
PD_21004882,Bootcut Selvedge Denim Gray Embroidered Jeans,Jeans,Nike,Women,2918
PD_21004883,Henley Polyester Black Striped Shirt,Shirt,Gap,Unisex,2277
PD_21004884,Trench Tweed Gray Ribbed Jacket,Jacket,Reebok,Unisex,2834
PD_21004885,Oversized Spandex Dark Green Colorblock Hoodie,Hoodie,Reebok,Unisex,2520
PD_21004886,Single-Breasted Linen Beige Pinstripe Blazer,Blazer,Pantaloons,Women,2808
PD_21004887,Regular Fit Poplin Beige Ribbed Shirt,Shirt,Nike,Men,2222
PD_21004888,Mermaid Linen Beige Textured Dress,Dress,Puma,Men,2596
PD_21004889,Formal Rayon Brown Checkered Shirt,Shirt,H&M,Men,1251
PD_21004890,Oversized Silk Charcoal Ribbed Shirt,Shirt,Uniqlo,Women,1922
PD_21004891,Classic Fit Poly Blend Navy Blue Herringbone Blazer,Blazer,Levi's,Women,2977
PD_21004892,Baja Wool Blend Gray Printed Hoodie,Hoodie,Puma,Unisex,1661
PD_21004893,Unstructured Cashmere Navy Blue Houndstooth Blazer,Blazer,H&M,Men,1538
PD_21004894,Zipper Alpaca Maroon Embroidered Sweater,Sweater,H&M,Women,997
PD_21004895,Distressed Denim White Faded Jeans,Jeans,Adidas,Unisex,851
PD_21004896,Bootcut Cotton Blend White Bleached Jeans,Jeans,Pantaloons,Men,1470
PD_21004897,Asymmetrical Linen Black Polka Dot Skirt,Skirt,Pantaloons,Unisex,2491
PD_21004898,Oversized Cotton White Floral Shirt,Shirt,Gap,Women,721
PD_21004899,Fitted Polyester Navy Blue Colorblock Hoodie,Hoodie,Zara,Unisex,1880
PD_21004900,Maxi Polyester Charcoal Geometric Dress,Dress,Reebok,Men,2742
PD_21004901,A-Line Silk White Colorblock Skirt,Skirt,Nike,Women,1801
PD_21004902,Distressed Denim Light Blue Acid Washed Jeans,Jeans,Zara,Unisex,2716
PD_21004903,Zip-Up Spandex Beige Checkered Hoodie,Hoodie,Levi's,Unisex,2614
PD_21004904,Hooded Tweed Navy Blue Solid Jacket,Jacket,Pantaloons,Women,2934
PD_21004905,Athletic Fleece Black Printed Hoodie,Hoodie,Uniqlo,Women,544
PD_21004906,Henley Spandex Beige Geometric T-Shirt,T-Shirt,Nike,Unisex,2786
PD_21004907,Flared Recycled Denim Olive Green Patchwork Jeans,Jeans,Uniqlo,Men,2706
PD_21004908,Skinny Rigid Denim Light Blue Embroidered Jeans,Jeans,Adidas,Men,2620
PD_21004909,Polo Tencel Beige Textured T-Shirt,T-Shirt,Nike,Unisex,823
PD_21004910,Classic Fit Poly Blend Brown Checkered Blazer,Blazer,Nike,Unisex,1952
PD_21004911,Cropped Wool Blend Black Embroidered Hoodie,Hoodie,Uniqlo,Men,2978
PD_21004912,Henley Poplin Navy Printed Shirt,Shirt,Reebok,Unisex,561
PD_21004913,Distressed Cotton Blend Washed Blue Printed Jeans,Jeans,Pantaloons,Unisex,2570
PD_21004914,Oversized Polyester Olive Green Solid Hoodie,Hoodie,Reebok,Men,1338
PD_21004915,Mini Rayon Beige Colorblock Dress,Dress,Levi's,Men,1732
PD_21004916,Pullover Wool Black Textured Sweater,Sweater,H&M,Men,2957
PD_21004917,Mini Cotton Brown Geometric Skirt,Skirt,H&M,Women,2346
PD_21004918,Bootcut Poly-Cotton Light Blue Distressed Jeans,Jeans,H&M,Men,2274
PD_21004919,Single-Breasted Cashmere Black Houndstooth Blazer,Blazer,Nike,Men,2778
PD_21004920,Denim Leather Navy Blue Embroidered Jacket,Jacket,Pantaloons,Women,1280
PD_21004921,Henley Mesh Dark Green Solid T-Shirt,T-Shirt,Uniqlo,Men,1625
PD_21004922,Regular Fit Cotton Beige Geometric Sweater,Sweater,H&M,Women,805
PD_21004923,Skinny Recycled Denim Washed Blue Patchwork Jeans,Jeans,Pantaloons,Unisex,2356
PD_21004924,Peacoat Canvas Maroon Quilted Jacket,Jacket,Zara,Men,1981
PD_21004925,Pocket Cotton Navy Blue Tie-Dye T-Shirt,T-Shirt,Zara,Men,1742
PD_21004926,Henley Polyester Black Textured Shirt,Shirt,Zara,Unisex,2204
PD_21004927,Mini Tulle Beige Embroidered Dress,Dress,Gap,Women,1597
PD_21004928,Maxi Satin Black Floral Skirt,Skirt,Reebok,Unisex,1090
PD_21004929,Formal Poplin Navy Striped Shirt,Shirt,Puma,Unisex,1250
PD_21004930,Unstructured Linen Brown Checkered Blazer,Blazer,Adidas,Men,1353
PD_21004931,Leather Nylon Olive Green Ribbed Jacket,Jacket,Nike,Women,1597
PD_21004932,Boyfriend Recycled Denim Beige Printed Jeans,Jeans,Zara,Unisex,1758
PD_21004933,Oversized Modal Brown Embroidered T-Shirt,T-Shirt,Nike,Women,921
PD_21004934,Polo Polyester Olive Green Floral Shirt,Shirt,Reebok,Women,1576
PD_21004935,Baja Nylon Dark Green Embroidered Hoodie,Hoodie,Pantaloons,Unisex,2678
PD_21004936,Casual Polyester Olive Green Colorblock Shirt,Shirt,Adidas,Unisex,2329
PD_21004937,Quilted Polyester Dark Green Quilted Jacket,Jacket,Levi's,Unisex,863
PD_21004938,Regular Fit Jersey Navy Geometric Shirt,Shirt,Adidas,Women,2955
PD_21004939,Mini Denim Beige Checkered Dress,Dress,Uniqlo,Unisex,2513
PD_21004940,Boyfriend Stretch Denim Indigo Printed Jeans,Jeans,Pantaloons,Unisex,2439
PD_21004941,Skinny Denim Washed Blue Whiskered Jeans,Jeans,Nike,Women,938
PD_21004942,Cardigan Cotton Brown Geometric Sweater,Sweater,Puma,Unisex,2103
PD_21004943,Leather Canvas Brown Quilted Jacket,Jacket,Gap,Women,619
PD_21004944,Cargo Polyester Maroon Textured Shorts,Shorts,Pantaloons,Unisex,1290
PD_21004945,Quilted Leather Beige Colorblock Jacket,Jacket,Zara,Unisex,2438
PD_21004946,Mandarin Collar Jersey Black Checkered Shirt,Shirt,Puma,Women,867
PD_21004947,Fitted Cotton Olive Green Camouflage Hoodie,Hoodie,Puma,Unisex,2367
PD_21004948,Baja Cotton Brown Checkered Hoodie,Hoodie,Reebok,Unisex,2393
PD_21004949,Mermaid Velvet White Polka Dot Dress,Dress,Adidas,Women,2992
PD_21004950,Trench Nylon Maroon Solid Jacket,Jacket,Puma,Men,1644
PD_21004951,High-Waisted Acid Wash Black Distressed Jeans,Jeans,Gap,Men,1220
PD_21004952,A-Line Rayon Olive Green Printed Dress,Dress,Puma,Unisex,1808
PD_21004953,Denim Fleece Maroon Printed Shorts,Shorts,H&M,Unisex,2761
PD_21004954,High-Waisted Stretch Denim Dark Blue Ripped Jeans,Jeans,Pantaloons,Men,2090
PD_21004955,Slim Fit Rayon Olive Green Striped T-Shirt,T-Shirt,Nike,Men,1224
PD_21004956,Sleeveless Knit Maroon Textured Hoodie,Hoodie,Reebok,Men,1539
PD_21004957,High-Waisted Linen Beige Colorblock Shorts,Shorts,Reebok,Women,2999
PD_21004958,Graphic Bamboo Maroon Ribbed T-Shirt,T-Shirt,Gap,Women,1070
PD_21004959,Single-Breasted Wool Beige Herringbone Blazer,Blazer,H&M,Unisex,2917
PD_21004960,Slim Fit Wool Brown Solid Blazer,Blazer,Uniqlo,Men,2846
PD_21004961,Polo Jersey Black Checkered T-Shirt,T-Shirt,Reebok,Men,847
PD_21004962,Asymmetrical Linen Brown Solid Skirt,Skirt,Reebok,Women,2579
PD_21004963,Boyfriend Stone Wash Light Blue Printed Jeans,Jeans,Reebok,Men,2640
PD_21004964,Maxi Linen Dark Green Textured Dress,Dress,Puma,Men,1051
PD_21004965,Formal Denim Navy Geometric Shirt,Shirt,Reebok,Women,2544
PD_21004966,Unstructured Poly Blend Black Pinstripe Blazer,Blazer,Uniqlo,Women,691
PD_21004967,High-Waisted Fleece Olive Green Checkered Shorts,Shorts,Zara,Unisex,1266
PD_21004968,Slim Fit Wool Gray Checkered Blazer,Blazer,Gap,Women,2193
PD_21004969,Quilted Fleece Brown Quilted Jacket,Jacket,Reebok,Men,690
PD_21004970,Slim Fit Selvedge Denim Gray Bleached Jeans,Jeans,Adidas,Men,1410
PD_21004971,Maxi Linen Navy Blue Striped Dress,Dress,Nike,Men,687
PD_21004972,Maxi Denim Brown Striped Dress,Dress,Uniqlo,Women,2279
PD_21004973,Trench Polyester Charcoal Quilted Jacket,Jacket,Levi's,Men,1103
PD_21004974,Longline Jersey Charcoal Embroidered T-Shirt,T-Shirt,Nike,Women,1750
PD_21004975,Oversized Spandex Beige Solid Hoodie,Hoodie,Uniqlo,Unisex,1861
PD_21004976,Zipper Silk Blend Maroon Textured Sweater,Sweater,Pantaloons,Women,577
PD_21004977,Polo Tencel White Geometric T-Shirt,T-Shirt,Uniqlo,Men,1066
PD_21004978,Casual Chambray Brown Geometric Shirt,Shirt,Pantaloons,Unisex,1613
PD_21004979,Zipper Cashmere Beige Checkered Sweater,Sweater,Adidas,Women,1109
PD_21004980,Athletic Fleece Gray Checkered Hoodie,Hoodie,Nike,Women,673
PD_21004981,Cropped Jirga Brown Colorblock Hoodie,Hoodie,Levi's,Women,1194
PD_21004982,Tapered Poly-Cotton Olive Green Acid Washed Jeans,Jeans,Gap,Men,682
PD_21004983,Flared Linen Dark Green Embroidered Skirt,Skirt,Uniqlo,Unisex,919
PD_21004984,Cardigan Cotton Olive Green Embroidered Sweater,Sweater,Levi's,Men,877
PD_21004985,Distressed Recycled Denim Indigo Ripped Jeans,Jeans,Nike,Women,1543
PD_21004986,Field Denim Charcoal Checkered Jacket,Jacket,Adidas,Men,1299
PD_21004987,Unstructured Poly Blend Navy Blue Houndstooth Blazer,Blazer,Uniqlo,Men,908
PD_21004988,Slim Fit Wool Black Checkered Blazer,Blazer,Gap,Unisex,2781
PD_21004989,Skinny Stretch Denim Light Blue Acid Washed Jeans,Jeans,Adidas,Men,1000
PD_21004990,Color Block Nylon Gray Camouflage Hoodie,Hoodie,Puma,Men,2564
PD_21004991,Midi Polyester Gray Polka Dot Dress,Dress,Adidas,Men,1532
PD_21004992,Athletic Mesh Brown Printed Shorts,Shorts,Uniqlo,Women,1299
PD_21004993,Pleated Chiffon Beige Checkered Skirt,Skirt,Levi's,Men,2620
PD_21004994,A-Line Chiffon Black Embroidered Dress,Dress,Adidas,Men,2896
PD_21004995,Asymmetrical Denim Dark Green Colorblock Skirt,Skirt,Pantaloons,Women,931
PD_21004996,Board Spandex Maroon Colorblock Shorts,Shorts,Reebok,Men,2292
PD_21004997,Casual Rayon Blue Printed Shirt,Shirt,Gap,Women,2094
PD_21004998,Tapered Acid Wash Olive Green Printed Jeans,Jeans,Puma,Men,1329
PD_21004999,Regular Fit Merino Wool White Solid Sweater,Sweater,Uniqlo,Men,1375
PD_21005000,Trench Fleece Maroon Checkered Jacket,Jacket,Zara,Men,2140
PD_21005001,Boyfriend Denim Charcoal Printed Jeans,Jeans,Levi's,Unisex,2847
PD_21005002,Polo Linen Navy Striped Shirt,Shirt,Nike,Men,1528
PD_21005003,V-Neck Modal Olive Green Geometric T-Shirt,T-Shirt,H&M,Unisex,1361
PD_21005004,Bootcut Rigid Denim Olive Green Solid Jeans,Jeans,Puma,Unisex,2465
PD_21005005,Chino Spandex Brown Geometric Shorts,Shorts,Uniqlo,Women,1258
PD_21005006,Hooded Suede Olive Green Ribbed Jacket,Jacket,Levi's,Men,675
PD_21005007,Oversized Acrylic Brown Textured Sweater,Sweater,Nike,Women,2955
PD_21005008,Formal Chambray Navy Embroidered Shirt,Shirt,Zara,Men,911
PD_21005009,Distressed Acid Wash Beige Whiskered Jeans,Jeans,Puma,Women,994
PD_21005010,Double-Breasted Wool Gray Pinstripe Blazer,Blazer,Zara,Women,1405
PD_21005011,Oversized Jersey White Striped T-Shirt,T-Shirt,Zara,Women,1831
PD_21005012,Double-Breasted Cashmere Gray Checkered Blazer,Blazer,Zara,Women,2863
PD_21005013,Slim Fit Twill Gray Ribbed Shirt,Shirt,Levi's,Unisex,756
PD_21005014,Midi Silk Olive Green Colorblock Dress,Dress,Nike,Women,2910
PD_21005015,Peacoat Tweed Beige Colorblock Jacket,Jacket,Nike,Unisex,807
PD_21005016,Regular Fit Denim Gray Textured Shirt,Shirt,Reebok,Unisex,2732
PD_21005017,Straight Leg Denim Washed Blue Solid Jeans,Jeans,Adidas,Unisex,1829
PD_21005018,Polo Twill Black Floral Shirt,Shirt,Zara,Men,2245
PD_21005019,Turtleneck Knitted Charcoal Embroidered Sweater,Sweater,Adidas,Men,1072
PD_21005020,Longline Linen White Striped T-Shirt,T-Shirt,Levi's,Women,2358
PD_21005021,Maxi Satin Olive Green Floral Dress,Dress,Gap,Unisex,1372
PD_21005022,Formal Jersey Brown Embroidered Shirt,Shirt,Pantaloons,Women,2818
PD_21005023,Oversized Spandex White Camouflage Hoodie,Hoodie,Levi's,Men,1214
PD_21005024,Wrap Velvet Navy Blue Geometric Skirt,Skirt,Nike,Unisex,2339
PD_21005025,Casual Poplin Maroon Printed Shirt,Shirt,Adidas,Women,1576
PD_21005026,Zipper Polyester Dark Green Cable Knit Sweater,Sweater,Puma,Unisex,575
PD_21005027,Bermuda Polyester Brown Ribbed Shorts,Shorts,Gap,Women,2851
PD_21005028,Polo Denim Maroon Printed Shirt,Shirt,H&M,Men,1021
PD_21005029,Running Linen Navy Blue Checkered Shorts,Shorts,Pantaloons,Men,1559
PD_21005030,Cardigan Fleece White Colorblock Sweater,Sweater,Levi's,Women,1442
PD_21005031,Oversized Nylon Black Textured Hoodie,Hoodie,Adidas,Men,2327
PD_21005032,Cargo Linen Olive Green Colorblock Shorts,Shorts,Gap,Men,1691
PD_21005033,Regular Fit Polyester Beige Checkered T-Shirt,T-Shirt,H&M,Women,1255
PD_21005034,Slim Fit Recycled Denim Gray Printed Jeans,Jeans,Levi's,Women,1221
PD_21005035,A-Line Silk Brown Printed Dress,Dress,Puma,Unisex,780
PD_21005036,Oversized French Terry Dark Green Geometric Hoodie,Hoodie,Nike,Men,1436
PD_21005037,Athletic Twill White Colorblock Shorts,Shorts,Gap,Men,1493
PD_21005038,Athletic Fleece Brown Geometric Shorts,Shorts,Puma,Women,800
PD_21005039,Boyfriend Recycled Denim Indigo Distressed Jeans,Jeans,Gap,Unisex,2788
PD_21005040,Running Twill Brown Solid Shorts,Shorts,H&M,Men,2769
PD_21005041,Slim Fit Wool Black Solid Blazer,Blazer,Pantaloons,Women,2984
PD_21005042,Sleeveless Knit Maroon Ribbed Hoodie,Hoodie,Puma,Unisex,1890
PD_21005043,Tapered Raw Denim Charcoal Ripped Jeans,Jeans,Gap,Unisex,1359
PD_21005044,Slim Fit Fleece Black Printed Sweater,Sweater,Puma,Unisex,2368
PD_21005045,Empire Waist Denim Navy Blue Checkered Dress,Dress,Levi's,Men,2038
PD_21005046,Empire Waist Cotton Gray Colorblock Dress,Dress,Reebok,Women,1380
PD_21005047,Longline Bamboo Olive Green Solid T-Shirt,T-Shirt,Uniqlo,Men,1237
PD_21005048,Flannel Silk White Checkered Shirt,Shirt,Zara,Men,2876
PD_21005049,Casual Rayon Maroon Floral Shirt,Shirt,Puma,Men,1034
PD_21005050,Straight Leg Raw Denim Olive Green Distressed Jeans,Jeans,Gap,Women,802
PD_21005051,Board Cotton Black Printed Shorts,Shorts,Adidas,Unisex,1125
PD_21005052,Puffer Wool Navy Blue Colorblock Jacket,Jacket,Pantaloons,Unisex,2375
PD_21005053,Fitted Acrylic Beige Printed Hoodie,Hoodie,Zara,Unisex,1462
PD_21005054,Longline Rayon Beige Checkered T-Shirt,T-Shirt,Gap,Women,2363
PD_21005055,Henley Silk Olive Green Checkered Shirt,Shirt,Levi's,Men,1943
PD_21005056,Mini Rayon Beige Embroidered Dress,Dress,Pantaloons,Men,2713
PD_21005057,Quilted Canvas Navy Blue Textured Jacket,Jacket,Pantaloons,Women,2068
PD_21005058,Running Polyester Charcoal Solid Shorts,Shorts,Pantaloons,Women,837
PD_21005059,A-Line Polyester Charcoal Checkered Dress,Dress,Puma,Men,1258
PD_21005060,Slim Fit Polyester Blue Colorblock Shirt,Shirt,Pantaloons,Men,1608
PD_21005061,Quilted Nylon White Checkered Jacket,Jacket,H&M,Women,765
PD_21005062,Classic Fit Cashmere Brown Herringbone Blazer,Blazer,Zara,Unisex,1564
PD_21005063,Athletic Jirga Brown Striped Hoodie,Hoodie,Zara,Unisex,2073
PD_21005064,Henley Spandex Black Printed T-Shirt,T-Shirt,Reebok,Unisex,1056
PD_21005065,Wrap Satin Beige Solid Skirt,Skirt,Adidas,Unisex,740
PD_21005066,Formal Rayon Olive Green Solid Shirt,Shirt,Pantaloons,Unisex,955
PD_21005067,Asymmetrical Polyester Charcoal Embroidered Skirt,Skirt,Reebok,Men,686
PD_21005068,Athletic Spandex Charcoal Colorblock Shorts,Shorts,Levi's,Men,928
PD_21005069,Relaxed Fit Acid Wash Olive Green Acid Washed Jeans,Jeans,Uniqlo,Women,2117
PD_21005070,Leather Tweed Dark Green Ribbed Jacket,Jacket,Adidas,Unisex,1842
PD_21005071,Slim Fit Poly Blend Brown Houndstooth Blazer,Blazer,H&M,Unisex,535
PD_21005072,Peacoat Suede Maroon Geometric Jacket,Jacket,Zara,Men,2605
PD_21005073,Classic Fit Cotton Gray Pinstripe Blazer,Blazer,Zara,Men,2272
PD_21005074,Crew Neck Polyester Beige Geometric T-Shirt,T-Shirt,H&M,Women,2424
PD_21005075,Pleated Tulle Charcoal Embroidered Skirt,Skirt,Nike,Women,1714
PD_21005076,Oversized Polyester Charcoal Ribbed Shirt,Shirt,Uniqlo,Unisex,2490
PD_21005077,A-Line Cotton Dark Green Textured Dress,Dress,Nike,Men,1157
PD_21005078,Crew Neck Linen Navy Blue Tie-Dye T-Shirt,T-Shirt,Levi's,Women,2915
PD_21005079,Classic Fit Poly Blend Navy Blue Solid Blazer,Blazer,Zara,Unisex,1469
PD_21005080,Puffer Denim Black Quilted Jacket,Jacket,Zara,Unisex,1576
PD_21005081,A-Line Tulle Gray Polka Dot Skirt,Skirt,Adidas,Unisex,920
PD_21005082,Oversized Cotton White Striped Shirt,Shirt,H&M,Men,2464
